party,chunk
SP,"Programm der Partei der
Schweiz
(Angenommen durch den Parteitag vom 27. und 28. Juni 1959 in Winterthur)
Die Leute kämpfen für eine Gesellschaftsordnung, die den Menschen
von wirtschaftlicher Ausbeutung befreit. Jeder Mensch soll unabhängig von
Herkommen und Besitz seine Anlagen und Fähigkeiten frei entfalten können. Die
Menschen dürfen durch keine Vorrechte benachteiligt und durch keine wirtschaftliche
Macht ausgebeutet werden. Solidarität und soziale Gerechtigkeit müssen die
Grundpfeiler der menschlichen Gemeinschaft bilden. Erst dann ist unsere
gesellschaftliche Ordnung so gestaltet, dass sie den Menschen von wirtschaftlichen
Gefahren und Not befreit, seine Rechte garantiert und ihm die Schönheiten des
Lebens erschliesst.
Eine auf der Vorherrschaft des Kapitals beruhende Wirtschaftsordnung ist nicht in
der Lage, dem gesamten Volke auf die Dauer Wohlstand und kulturellen Aufstieg zu
sichern. Der Sozialismus will jedermann eine menschenwürdige Existenz"
SP,"sichern. Der Sozialismus will jedermann eine menschenwürdige Existenz
ermöglichen, dem Volke Wohlstand verschaffen und der Pflege der kulturellen Werte
dienen.
Die Partei der Schweiz steht auf dem Boden der Demokratie.
Sie verurteilt und bekämpft jede Diktatur. Wahre Demokratie ist ein Ziel, das immer
wieder neu erkämpft werden muss. Wahre Demokratie beruht auf der
Gleichberechtigung aller Menschen und der Sicherung ihres Mitspracherechtes in
Staat und Wirtschaft. Wahre Demokratie rückt den Menschen in den Mittelpunkt alles
gesellschaftlichen Geschehens.
In der Schweiz wie in ganz Europa werden Freiheit, Demokratie, soziale
Gerechtigkeit und allgemeiner Wohlstand nur dann zu begründen und zu erhalten
sein, wenn überall auf der Erde die Menschen von Krieg und Armut, Furcht und
Rechtlosigkeit befreit werden. Die Ausbreitung und Vertiefung der Demokratie und
der freie Gedankenaustausch zwischen allen Völkern schaffen die wesentlichen"
SP,"der freie Gedankenaustausch zwischen allen Völkern schaffen die wesentlichen
Grundlagen für ein friedliches Zusammenleben der Menschen. Die Schweiz muss
daher, bei Wahrung ihrer militärischen Neutralität, die internationale Solidarität
hochhalten und im Rahmen der internationalen Organisationen tatkräftig mitwirken.
I. Aussenpolitik und Landesverteidigung
Die Partei der Schweiz unterstützt die auf die Einigung Europas
und der Welt in einer freiheitlichen demokratischen Föderation gerichteten
Bestrebungen. Die Leute bejahen damit grundsätzlich die Notwendigkeit
für die Schweiz, sich den Vereinten Nationen anzuschliessen; dabei ist die
militärische Neutralität unseres Staates zu wahren. Die historische Tradition und die
geographische Lage der Schweiz gebieten im Lebensinteresse unseres Volkes diese
Neutralität. Sie dient dadurch, dass sie die Entfaltung vielfacher humanitärer
Tätigkeiten ermöglicht, erfahrungsgemäss auch den andern Nationen. Diese"
SP,"Tätigkeiten ermöglicht, erfahrungsgemäss auch den andern Nationen. Diese
Sonderstellung befreit uns aber nicht von der Aufgabe, an den Bemühungen der
Vereinten Nationen zur Wahrung des Friedens solidarisch mitzuarbeiten. In
Übereinstimmung mit der Personischen Internationale setzt sich die
2
Partei der Schweiz für eine allgemeine und kontrollierte
Abrüstung ein.
Die Zusammenarbeit aller Nationen und eine grosszügige Unterstützung der
Entwicklungsländer sind notwendig, um die durch Kolonialpolitik verschärften
Gegensätze zwischen weissen und farbigen Völkern zu überwinden. Unser Land
muss den wirtschaftlich und technisch weniger entwickelten Völkern in
uneigennütziger Weise helfen.
Die Schweiz muss die zum Schutze ihrer Unabhängigkeit und ihrer Neutralität
notwendigen Massnahmen treffen, solange weltpolitische Spannungen die
Menschheit mit Krieg bedrohen und eine den Frieden sichernde Politik der
Grossmächte nicht besteht. Die Landesverteidigung beschränkt sich nicht auf das"
SP,"Grossmächte nicht besteht. Die Landesverteidigung beschränkt sich nicht auf das
militärische Gebiet; sie umfasst alle Massnahmen und Tätigkeiten, die im
wirtschaftlichen, sozialen und geistigen Bereich dazu beitragen, den
Widerstandswillen des Volkes zu stärken.
Alle Massnahmen der Landesverteidigung sind unter Berücksichtigung der
Verhältnisse unseres Kleinstaates so zu planen, dass bei volkswirtschaftlich
tragbarem Aufwand die grösstmögliche Wirkung erzielt wird. Zur Finanzierung der
Rüstung sind hohe Einkommen und Vermögen angemessen heranzuziehen. Die
Gewinne der Rüstungsindustrie sind durch staatliche Kontrolle von Produktion und
Gestehungskosten zu beschränken. Der Staat hat überdies die Waffenausfuhr zu
kontrollieren.
Die Militärausgaben dürfen den weiteren fortschrittlichen Ausbau der Sozialpolitik
nicht beeinträchtigen.
Die schweizerische Armee muss eine Volksarmee bleiben. Auch bei den aus
militärisch-technischen Gründen vorzunehmenden Änderungen ihrer Organisation ist"
SP,"militärisch-technischen Gründen vorzunehmenden Änderungen ihrer Organisation ist
an der Milizarmee festzuhalten. Die Dienstordnung soll die innere Freiheit und
persönliche Würde des Wehrmannes respektieren. Für die Dienstverweigerer aus
Gewissensgründen ist eine menschlich befriedigende Lösung zu finden,
insbesondere durch Schaffung eines Zivildienstes.
II. Wirtschaftspolitik
Aller wirtschaftliche Erfolg beruht auf menschlicher Arbeit. Ihr soll jene
gesellschaftliche Wertung zukommen, die ihr als wichtigstem Faktor unserer
Volkswirtschaft gebührt. Im Mittelpunkt der unsere Wirtschaftspolitik
steht der Mensch mit seinen Bedürfnissen, seinen Rechten und seiner Würde.
Wirtschaftliche Demokratie und Menschlichkeit sind höher zu werten als Technik und
Profit.
Die wirtschaftspolitischen Massnahmen bezwecken die Sicherung und Förderung
des Wohlstandes für alle.
Die unmittelbaren wirtschaftspolitischen Ziele sind:"
SP,"des Wohlstandes für alle.
Die unmittelbaren wirtschaftspolitischen Ziele sind:
– Verwendung aller produktiven Wirtschaftskräfte und Steigerung der Produktivität
der gesamten Volkswirtschaft sowie der einzelnen Wirtschaftszweige;
– Vollbeschäftigung und Stetigkeit der wirtschaftlichen Entwicklung;
– Gerechter Anteil des einzelnen am Volkseinkommen und Volksvermögen;
– Verhinderung des Missbrauchs wirtschaftlicher Macht;
3
– Verwirklichung demokratischer Grundsätze in der Wirtschaft.
Zur Erreichung dieser Ziele sind folgende Richtlinien massgebend:
1. Die Wirtschaftspolitik hat durch planmässige Lenkung auf nationaler und
internationaler Ebene die Vollbeschäftigung sowie eine stetige Entwicklung der
Wirtschaft bei stabilem Preisniveau anzustreben; ein sinnvolles Mass an
wirtschaftlichen Initiativ- und Entfaltungsmöglichkeiten ist dabei zu gewähren.
Insbesondere soll die Freiheit der Wahl des Arbeitsplatzes und des Konsums
gewahrt werden."
SP,"Insbesondere soll die Freiheit der Wahl des Arbeitsplatzes und des Konsums
gewahrt werden.
2. Durch Verbesserung der Produktionsmethoden, durch Förderung der
wissenschaftlichen und technischen Forschung und der zweckmässigen
Ausbildung der für die verschiedenen Fachgebiete benötigten Arbeitskräfte soll
eine Entwicklung der Produktivkräfte erreicht werden, die dem Einzelnen ein
wachsendes Einkommen sichert, ohne ihn einer gesteigerten psychischen und
physischen Belastung auszusetzen.
3. Ein fairer Wettbewerb dient der Steigerung von Leistung und Ertrag. Dabei sind
möglichst gleiche Ausgangsbedingungen zu schaffen; der Aufstieg ist in
angemessener Weise zu erleichtern.
4. Der Anteil des Einzelnen am Volkseinkommen ist grundsätzlich nach seiner
Leistung zu bemessen, wobei soziale Gesichtspunkte zu berücksichtigen sind.
Die Arbeitseinkommen sind entsprechend der volkswirtschaftlichen Produktivität
zu erhöhen.
5. 6. 7. 8. Der Missbrauch wirtschaftlicher Macht durch Kartelle und ähnliche"
SP,"zu erhöhen.
5. 6. 7. 8. Der Missbrauch wirtschaftlicher Macht durch Kartelle und ähnliche
Organisationen sowie durch Trusts und andere Grossunternehmungen ist zu
bekämpfen.
Bei monopolistischen Unternehmungen und Organisationen sind entweder die
Voraussetzungen des fairen Wettbewerbes zu schaffen, oder es sind dieselben
unter öffentliche Kontrolle zu stellen oder in Gemeineigentum überzuführen.
Ebenso können private Unternehmungen, deren Tätigkeit im öffentlichen
Interesse liegt, in gemeinwirtschaftliche Formen überführt werden.
Die Gemeinwirtschaft in den Formen der Genossenschaft, der
Selbstverwaltungskörperschaft, des staatlichen, kommunalen oder
gemischtwirtschaftlichen Unternehmens ist zu fördern.
Bei den Entscheidungen über Richtung und Massnahmen der Wirtschaftspolitik
ist den einzelnen Wirtschaftsgruppen und Berufsverbänden, im besonderen
auch den Arbeitnehmern und Konsumenten, das Mitspracherecht einzuräumen.
III. Finanzpolitik"
SP,"auch den Arbeitnehmern und Konsumenten, das Mitspracherecht einzuräumen.
III. Finanzpolitik
Die Finanzpolitik ist in Bund, Kanton und Gemeinde eines der wichtigsten
Instrumente der Wirtschaftspolitik. Sie soll dazu dienen, die Produktivität zu erhöhen,
den allgemeinen Lebensstandard zu heben, die gerechte Verteilung des
Volkseinkommens zu sichern und die gebotenen Reformen ökonomischer und
sozialer Natur zu ermöglichen.
Die unmittelbaren finanzpolitischen Ziele der Partei der
Schweiz sind:
– Deckung des Finanzbedarfs für alle vom Gemeinwesen zu erfüllenden Aufgaben;
4
– gebend:
– Gerechte Verteilung der Steuerlasten nach der wirtschaftlichen Leistungsfähigkeit
sowie sozialer Ausgleich zwischen grossen und kleinen Einkommen und
Vermögen;
– Beeinflussung des Konjunkturablaufs im Sinne eines Ausgleichs der im
Wirtschaftsleben auftretenden Schwankungen.
Zur Erreichung dieser Ziele sind folgende Richtlinien massgebend:"
SP,"Zur Erreichung dieser Ziele sind folgende Richtlinien massgebend:
1. Die erforderlichen Mittel des öffentlichen Haushalts sind erster Linie durch
progressive Einkommens-, Vermögens- und Erbschaftssteuern aufzubringen, da
diese die Steuerpflichtigen nach ihrer wirtschaftlichen Leistungsfähigkeit
erfassen. Einkommen, die nur zur Beschaffung des notwendigen
Lebensbedarfes dienen, bleiben steuerfrei. Konsumsteuern sind auf eine
Belastung des nicht notwendigen Verbrauchs zu beschränken. Einheitliche
Veranlagung sowie Vorkehren gegen Steuerflucht und Steuerhinterziehung
sorgen für gerechte Belastung aller Steuerpflichtigen.
2. Durch Sozialabzüge und geeignete Progression werden kleine Einkommen und
Vermögen wesentlich entlastet, grosse entsprechend stärker belastet.
3. Um eine gleichmässigere Verteilung der Vermögen zu erzielen, sind die grossen
Hinterlassenschaften unter Berücksichtigung des Verwandtschaftsgrades und
der sozialen Lage der Erben zu besteuern."
SP,"der sozialen Lage der Erben zu besteuern.
4. Die Finanz- und Steuerpolitik ist konjunkturgerecht auf die Wirtschaftslage
auszurichten. Der Staatshaushalt soll den Konjunkturperioden entsprechend
ausgeglichen sein.
5. Die Kapitalbildung durch die öffentliche Hand, insbesondere die Anlage von
Reserven für Arbeitsbeschaffung in Zeiten wirtschaftlicher Depression, wird
gefördert.
6. Zwischen finanziell schwachen und starken Gemeinwesen wird ein
angemessener Finanzausgleich hergestellt.
7. Die verschiedenen Mittel und Massnahmen der Finanz und Wirtschaftspolitik
werden koordiniert und den allgemeinen Zielen untergeordnet.
IV. Einzelfragen der Wirtschafts- und Finanzpolitik
1. Geld-, Kredit- und Währungspolitik
Geld und Kredit sind den allgemeinen wirtschaftlichen Zielen unterzuordnen Der
Geldumlauf ist durch die Nationalbank nach dem Bedarf der Volkswirtschaft zu
regulieren. Inflation sowie Deflation sind zu verhüten."
SP,"regulieren. Inflation sowie Deflation sind zu verhüten.
Die Kreditpolitik ist so zu gestalten, dass die Wirtschaft mit dem für ihre Entwicklung
nötigen Kapital versorgt wird.
Die Zinsbelastung der Wirtschaft soll möglichst gering sein. In Zeiten von
Beschäftigungsmangel sind Krediterleichterungen zu gewähren. Sofern
Einschränkungen des Kredits notwendig werden, müssen gezielte Massnahmen
getroffen werden, um die im Interesse der Versorgung und eines gesunden
Wachstums der Wirtschaft erforderlichen Investitionen zu ermöglichen und
Preissteigerungen zu verhindern.
5
Im Interesse stabiler Wirtschaftsbeziehungen mit dem Ausland sind feste
Wechselkurse erwünscht; doch darf das starre Festhalten am Goldkurs des
Frankens nicht zu einer Deflationspolitik führen.
2. Produktionspolitik
Die Produktion von Gütern und die Dienstleistungen sind auf allen Gebieten
möglichst rationell zu gestalten. Rationalisierungsbestrebungen sind zu unterstützen,"
SP,"möglichst rationell zu gestalten. Rationalisierungsbestrebungen sind zu unterstützen,
soweit es sich um echte Rationalisierung handelt, das heisst um Verbesserungen
der Produktivität ohne Mehrbeanspruchung des arbeitenden Menschen. Die
steigende Produktivität der Wirtschaft durch Rationalisierung, Automation usw. soll
den Arbeitnehmern in der Form von Lohnerhöhungen, grösserer Freizeit sowie
Preissenkungen zugute kommen. Die Investitionstätigkeit sollte möglichst stetig
verlaufen, da Schwankungen auf diesem Gebiet eine der wesentlichen
Krisenursachen bilden.
Die Nutzung und der Ausbau von Wasserkraft, von Erdöl und Erdgasquellen sowie
die Erzeugung von Atomenergie sind zu koordinieren. Die Energiewirtschaft ist als
allgemeiner öffentlicher Dienst zu gestalten.
Im Interesse einer stetigen Entwicklung der Wirtschaft ist ein umfassender Ausbau
der Wirtschaftsstatistik und die Aufstellung eines volkswirtschaftlichen Budgets
erforderlich.
3. Konjunkturpolitik"
SP,"erforderlich.
3. Konjunkturpolitik
Durch Ausnutzung aller Möglichkeiten der Wirtschafts- und Finanzpolitik ist
bestehenden oder drohenden Gleichgewichtsstörungen der Gesamtwirtschaft oder
einzelner Teile derselben entgegenzuwirken. Insbesondere sind die nötigen
Reserven und Projekte für die Arbeitsbeschaffung vorsorglich bereitzustellen.
Die Arbeiten und Aufträge der öffentlichen Hand sind nach konjunkturpolitischen
Erfordernissen vorzunehmen. In Zeiten der Vollbeschäftigung sind nicht dringliche
Arbeiten zu verschieben, während in Zeiten von Arbeitslosigkeit die öffentlichen
Aufträge nach Möglichkeit den Ausfall der Nachfrage der Privatwirtschaft ersetzen
sollen.
Da angesichts der engen Verflechtung der Schweiz mit der Weltwirtschaft
Kriseneinbrüche durch konjunkturpolitische Massnahmen nicht unbedingt verhindert
werden können, sind alle geeigneten Massnahmen zu treffen, um den
Arbeitnehmern ihren angestammten Arbeitsplatz zu erhalten oder ihnen in"
SP,"Arbeitnehmern ihren angestammten Arbeitsplatz zu erhalten oder ihnen in
Berücksichtigung ihrer beruflichen, körperlichen und familiären Möglichkeiten eine
zumutbare neue Beschäftigung zu bieten.
4. Preispolitik
Die Preispolitik muss auf die Erhaltung eines stabilen Preisniveaus ausgerichtet sein.
Der Verteilungsapparat ist möglichst rationell zu gestalten. Wo die Konkurrenz nicht
spielt, ist eine Preisüberwachung erforderlich; übersetzte Preise sind durch
Preiskontrolle und Preisvorschriften zu verhindern. Wo Mangel an wichtigen Gütern
herrscht, sind besondere Massnahmen zu treffen, um das Angebot zu vermehren.
5. Aussenhandelspolitik
Die Aussenhandelspolitik hat der Versorgung der Konsumenten wie der produktiven
Wirtschaft zu dienen. Die Zölle sind niedrig zu halten, Rohstoffe und Lebensmittel
6
freizulassen. Schutzmassnahmen sind nur gerechtfertigt, um Wirtschaftszweige zu
erhalten, die als lebenswichtig betrachtet werden, und nur unter der Voraussetzung,"
SP,"erhalten, die als lebenswichtig betrachtet werden, und nur unter der Voraussetzung,
dass trotz des Schutzes nach höchster Produktivität getrachtet wird. Der Schutz der
Landwirtschaft ist so zu regeln, dass die zur Ergänzung der Inlandproduktion
notwendige Einfuhr nicht verteuert wird. Finanzzölle sind zu beschränken auf Güter,
die dem Luxuskonsum dienen.
6. Agrarpolitik
Die Partei der Schweiz setzt sich ein für die Erhaltung eines
gesunden, selbständigen Bauernstandes auf eigenem Boden. Sie ist bereit, im
Rahmen der Absatzmöglichkeiten und der notwendigen Rücksichtnahme auf die
Konsumenten, einer Sicherung der Preise für landwirtschaftliche Erzeugnisse
zuzustimmen, die den Bauern einen angemessenen Arbeitsverdienst gewährt.
Voraussetzung eines solchen Preisschutzes muss jedoch sein: eine ernsthafte
Bekämpfung der Spekulation mit landwirtschaftlichem Boden und seiner
Überzahlung, ferner eine durch fortschrittliche Betriebsberatung unterstützte,"
SP,"Überzahlung, ferner eine durch fortschrittliche Betriebsberatung unterstützte,
rationelle Arbeitsweise der Bauernbetriebe. Eine solche ist nur möglich wenn der
übermässigen Zerstückelung des Bodens und der Aufteilung in zu kleine
Betriebseinheiten durch rationelle Güterzusammenlegung wirksam begegnet wird.
Die Verbesserung der Produktivität ist mit allen Mitteln zu fördern.
Wo wirtschaftliche Hilfe zur Überwindung der Existenzschwierigkeiten der Klein- und
Bergbauern nicht ausreicht sind sozialpolitische Massnahmen notwendig. Die
Entwicklung wirtschaftlich stark benachteiligter Gegenden ist soweit möglich durch
Ansiedlung von Industrie und Gewerbe zu fördern.
7. Bodenpolitik
Die rationelle Verwendung des Bodens macht eine Orts-, Regional- und
Landesplanung notwendig. Diese Planung bedingt gesetzliche Einschränkungen des
Eigentumsrechtes Da der Boden unvermehrbar ist, hat der Landeigentümer,
namentlich in günstigen Lagen, eine privilegierte, oft monopolähnliche Stellung, die"
SP,"namentlich in günstigen Lagen, eine privilegierte, oft monopolähnliche Stellung, die
ihm eine unverdiente Rente gewährt. Der ständigen Preissteigerung des Bodens, die
durch Spekulation noch verschärft wird, ist durch geeignete Massnahmen
entgegenzutreten. Vor allem müssen Staat und Gemeinden durch vorsorglichen
Kauf von Land für Siedlungszwecke der Verteuerung des Baulandes und damit auch
der Wohnungsmieten entgegenwirken. Öffentlicher Boden soll grundsätzlich nicht
wieder an Private verkauft werden, doch ist durch Einräumung des Baurechtes
Privaten das Bauen auf öffentlichem Boden zu ermöglichen. Der Wertzuwachs des
Bodens sowie die Gewinne aus dem Grundstückhandel sind scharf zu besteuern.
8. Verkehrspolitik
Ein zweckmässig ausgebautes Verkehrsnetz hat der raschen, sicheren und
möglichst billigen Beförderung von Personen und Gütern zu dienen. Der
Arbeitnehmer soll den Arbeitsort unter geringstem Zeitaufwand erreichen können."
SP,"Arbeitnehmer soll den Arbeitsort unter geringstem Zeitaufwand erreichen können.
Die öffentlichen Verkehrsmittel sollen in Allgemeinbesitz überführt werden.
Die Verkehrspolitik hat dazu beizutragen, die Produktivität zu steigern und den
allgemeinen Wohlstand zu mehren, vor allem durch:
– wirtschaftliche Koordination der Verkehrsträger;
– soziale Tarifpolitik;
7
– erhöhte Verkehrssicherheit;
– Angleichung der Konkurrenzbedingungen durch gerechte Kostenbelastung der
verschiedenen Verkehrsmittel und Angleichung der Arbeitsbedingungen;
– Bekämpfung des Lärms und anderer gesundheitlicher Schädigungen.
– Fremdenverkehr und Sozialtourismus sind zu fördern.
9. Genossenschaftswesen
Die Genossenschaft ist die älteste Form der Wirtschaftsdemokratie. Sie ermöglicht,
namentlich den wenig bemittelten Volkskreisen, Konsumenten, Arbeitern,
Angestellten, Bauern, Gewerbetreibenden, sich die organisatorischen und
technischen Vorteile der modernen Wirtschaftsführung in gemeinsamen"
SP,"technischen Vorteile der modernen Wirtschaftsführung in gemeinsamen
Unternehmungen nutzbar zu machen. Die Personie unterstützt daher die
Anwendung echter genossenschaftlicher Grundsätze in allen Wirtschaftsgebieten.
10. Internationale wirtschaftliche Zusammenarbeit
Die Bestrebungen zur europäischen und internationalen wirtschaftlichen
Zusammenarbeit sollen unterstützt werden. Die Partei der
Schweiz tritt deshalb für eine aktive Mitarbeit in den zu diesem Zwecke geschaffenen
Organisationen ein.
V. Sozialpolitik
Die Sozialpolitik soll Schutz vor Armut, Bedrängnis und wirtschaftlicher Unsicherheit
gewähren. Sie hat dabei die Persönlichkeit und Würde des Menschen zu achten und
ihm behilflich zu sein, sein Leben sinnvoll zu gestalten.
Soziales Handeln soll nicht nur vom Staat ausgehen; notwendig ist auch die
Mitarbeit von Einzelnen und von Organisationen der gegenseitigen Hilfe.
Die unmittelbaren sozialpolitischen Ziele der Partei der
Schweiz sind:"
SP,"Die unmittelbaren sozialpolitischen Ziele der Partei der
Schweiz sind:
– Sicherung der Würde des Menschen in der Wirtschaft;
– Sicherung der Familie;
– Schutz des arbeitenden Menschen durch Ausbau des Arbeitsrechts;
– Wirtschaftliche und soziale Sicherung der Erwerbsunfähigen;
– Errichtung eines umfassenden Gesundheitsdienstes.
Zur Erreichung dieser Ziele sind folgende Richtlinien massgebend:
1. Die Erweiterung des Mitsprache- und Mitbestimmungsrechtes der Arbeitnehmer
soll eine Neuorientierung des Verhältnisses zwischen Arbeitnehmern und
Arbeitgebern im Sinne der Gleichberechtigung herbeiführen. Es sind gleiche
Entwicklungs- und Aufstiegschancen für alle anzustreben.
2. Das Recht der Gewerkschaften, unabhängig vom Staat den Zusammenschluss
der Arbeitnehmer zu organisieren und für bessere Arbeitsbedingungen zu
kämpfen, ist zu gewährleisten, ebenso die uneingeschränkte Koalitionsfreiheit
dem Unternehmer gegenüber. Die Festsetzung der Löhne ist grundsätzlich der"
SP,"dem Unternehmer gegenüber. Die Festsetzung der Löhne ist grundsätzlich der
freien Vereinbarung zwischen Gewerkschaften und Arbeitgebern vorbehalten.
8
3. 4. 5. 6. 7. Wo dies in einzelnen Wirtschaftszweigen nicht möglich ist, sind Mindestlöhne
gesetzlich vorzuschreiben.
Für gleichwertige Leistungen von Männern und Frauen sind gleiche Löhne zu
bezahlen. Die Arbeiten, die üblicherweise von Frauen verrichtet werden, sind
nach denselben Massstäben zu bewerten wie Männerarbeit.
Das Arbeitsrecht wird einheitlich ausgebaut, vor allem in Hinsicht auf die
Achtung der Persönlichkeit, die Verkürzung der Arbeitszeit, die Gewährleistung
bezahlter Ferien, die Sicherung des Arbeitsplatzes, im besonderen gegen
ungerechtfertigte Kündigung, und den Schutz von Leben und Gesundheit, unter
besonderer Rücksichtnahme auf Frauen und Jugendliche. Die berufliche
Ausbildung ist nachdrücklich zu fördern. Verheirateten Frauen ist das freie
Entscheidungsrecht zur Ausübung einer eigenen Erwerbsarbeit zu gewähren."
SP,"Entscheidungsrecht zur Ausübung einer eigenen Erwerbsarbeit zu gewähren.
Jedem, der nicht für seinen Lebensunterhalt aufkommen kann, soll eine
menschenwürdige Existenz gesichert werden. Diesem Zwecke dient der Ausbau
und die Ergänzung der Sozialversicherung, nämlich:
Alters- und Hinterlassenenversicherung;
Krankenversicherung;
Unfallversicherung mit Einschluss der Berufskrankheiten;
Mutterschaftsversicherung;
Invalidenversicherung, einschliesslich Umschulung und Wiedereingliederung ins
Erwerbsleben;
Arbeitslosenversicherung;
Ausgleichskassen für Kinderzulagen;
Militärversicherung und Erwerbsersatzordnung.
Eine Koordination der einzelnen Versicherungszweige wird die rationelle
Gestaltung der Leistungen ermöglichen. Wo soziale Schäden nicht anders
behoben werden können, setzt die Fürsorge ein. Sie soll die Selbständigkeit des
Hilfsbedürftigen so weit wie möglich wiederherstellen.
Ein auf den neuesten medizinischen Erkenntnissen beruhender, der"
SP,"Ein auf den neuesten medizinischen Erkenntnissen beruhender, der
Vorbeugung und Heilung gewidmeter Gesundheitsdienst soll allen Menschen
ohne Rücksicht auf ihre finanziellen Mittel zur Verfügung stehen. Besondere
Hilfe ist geschädigten und schwererziehbaren Kindern zu leisten.
Die Selbsthilfewerke werden nach Möglichkeit zur Mitarbeit an der staatlichen
Sozialpolitik herangezogen.
Bei der Organisation der Sozialwerke soll die Selbstverwaltung in der Weise
ausgebaut werden, dass der Einfluss des Einzelnen auf die sozialpolitische
Tätigkeit und damit auch sein Verantwortungsbewusstsein sich erhöht. Durch
geeignete Massnahmen soll verhütet werden, dass soziale Leistungen zu einer
Einschränkung der Eigenpersönlichkeit des Empfängers führen.
Zu den wichtigsten sozialpolitischen Aufgaben gehört die Förderung des
Wohnungsbaus, insbesondere der genossenschaftlichen und kommunalen
Bautätigkeit, mit dem Ziel, gesunde Wohnungen zu mässigen Mietzinsen in"
SP,"Bautätigkeit, mit dem Ziel, gesunde Wohnungen zu mässigen Mietzinsen in
genügender Zahl zu beschaffen; dabei sind die Bedürfnisse kinderreicher
Familien zu berücksichtigen.
Die nationale und regionale Planung soll den Menschen dienen: Grünflächen
und Spielplätze sollen jedem Sonne und Raum sichern; medizinische Dienste
sind in der Nähe der Wohnzentren zu errichten, der Verkehr ist von den
Wohnstätten fernzuhalten.
9
8. Die Sozialpolitik ist mit der Wirtschafts- und Finanzpolitik zu koordinieren. Auf
internationalem Gebiet sind gleichgerichtete sozialpolitische Bestrebungen zu
fördern.
VI. Recht und Staat
Für die Leute ist der Staat nicht Selbstzweck, sondern eine Einrichtung,
die im Zusammenleben der Menschen Ordnung, Gerechtigkeit und Wohlfahrt sichert.
Der Staat ist um der Menschen willen da und nicht die Menschen um des Staates
willen.
Die wirtschaftliche und soziale Befreiung der Menschen setzt die persönliche und"
