party,chunk
GPS,"des 21. Jahrhunderts. Statt weiter an der fossilen Wirtschaft festzuhalten, wollen wir die
Klima- und die Energiewende zu einer Chance für uns alle machen – mit Zukunftsjobs und
Kreislaufwirtschaft; mit lebenswerten, lebendigen und sozial durchmischten Quartieren und
Dörfern; mit einer Landwirtschaft, die nachhaltige und gesunde Nahrungsmittel produziert;
sowie mit einer modernen und umweltverträglichen Verkehrsinfrastruktur.
4.1 INNOVATION UND KREISLAUFWIRTSCHAFT
Unser Wirtschaftssystem hat dem Globalen Norden in den vergangenen Jahrzehnten einen
nie da gewesenen materiellen Wohlstand beschert. Dies jedoch zu einem Preis, den wir
nicht länger bezahlen können: Die Menschheit hat mittlerweile so viele natürliche Ressour-
cen aus der Erde gekratzt, gepumpt und geschaufelt, dass viele davon bald ausgehen. Und
der vermeintliche Rohstoffsegen hat sich bald als Fluch herausgestellt: Der gierige Abbau
und die Verarbeitung von Rohstoffen verursachen irreversible Schäden an der Umwelt, füh-"
GPS,"und die Verarbeitung von Rohstoffen verursachen irreversible Schäden an der Umwelt, füh-
ren zur Ausbeutung und Entrechtung von Menschen und, in letzter Konsequenz, zu Kriegen.
Wir Leute setzen uns für eine Wirtschaft im Rahmen der planetaren Grenzen ein. Dafür
braucht es einen fundamentalen Wandel weg von Verschwendung und Ressourcenver-
schleiss, hin zur Kreislaufwirtschaft. Diese haben wir Leute 2011 mit der Volksinitiative für
eine Grüne Wirtschaft auf die politische Agenda gesetzt. Die Schweiz muss zu einer Vorrei-
terin in Sachen Kreislaufwirtschaft werden. Durch eine effizientere Nutzung der Rohstoffe
19/34
und der Energie sinken die Abhängigkeit von teils volatilen Rohstoffmärkten und autokrati-
schen Regimen, aber auch die Produktionskosten.
Die ökologische Wende ist eine wirtschaftliche Chance, die zur Entstehung neuer Branchen,
neuer Arbeitsplätze und neuer Geschäftsfelder führt. Die Schweiz als Land mit hohen techni-"
GPS,"neuer Arbeitsplätze und neuer Geschäftsfelder führt. Die Schweiz als Land mit hohen techni-
schen Standards und grosser Innovationskraft hat hier einen Vorteil. Um die Transformation
in ein stabileres und nachhaltigeres Wirtschaftssystem zu fördern, müssen Unternehmen,
Hochschulen und Politik allerdings gut zusammenarbeiten. Denn obwohl die Schweiz zu den
innovativsten und wohlhabendsten Volkswirtschaften der Welt gehört, schneidet sie bei-
spielsweise bei der Finanzierung von Start-ups nur unterdurchschnittlich ab. Wir Leute
wollen deshalb Anreize schaffen für Investitionen in Innovation und neue Unternehmensmo-
delle und so den Ausstieg aus den fossilen Energien weiter vorantreiben.
In der nächsten Legislatur wollen wir Leute Folgendes erreichen:
• Wir setzen die Parlamentarische Initiative «Schweizer Kreislaufwirtschaft stärken»
um und schliessen Stoff- und Energiekreisläufe. Dabei ist insbesondere der Bausek-
tor einzubeziehen."
GPS,"tor einzubeziehen.
• Wir erhöhen die Lebensdauer von Konsumgütern, indem wir ein Recht auf Repara-
tur für alle Produkte schaffen, die Garantiedauer erhöhen und ein Reparaturfähig-
keitsindex für elektrische und elektronische Geräte einführen.
• Wir lancieren einen nationalen Forschungsschwerpunkt im Bereich Klima, Ener-
gie und grüner Wirtschaft im Umfang von 100 Millionen Franken für die nächsten
vier Jahre.
• Wir führen ein «Right to Use» (Recht auf Nutzung) ein, um eine nachhaltige Nut-
zung elektronischer Geräte zu ermöglichen und deren Lebensdauer zu verlängern,
Dies umfasst verbindliche Standards für die Interoperabilität elektronischer Geräte,
das Recht auf die freie Wahl von Betriebssystemen, Software und Anbietern von On-
linediensten für alle Geräte sowie die Pflicht zur Offenlegung der Quellcodes von
Treibern, Tools und der Dokumentation notwendiger Schnittstellen.
• Wir gründen einen Staatsfonds für Start-Ups, welche sich am Gemeinwohl orientie-"
GPS,"• Wir gründen einen Staatsfonds für Start-Ups, welche sich am Gemeinwohl orientie-
ren und einen sozialen, ökologischen oder demokratischen Nutzen aufweisen.
• Wir verpflichten Vorsorgeeinrichtungen dazu, im Sinne einer Anschubfinanzierung
innert zehn Jahren mindestens ein Prozent ihres Anlageportfolios in Schweizer
Cleantech-Firmen und anderen Unternehmen zu investieren, welche Innovationen für
die ökologische Wende vorantreiben.
• Wir wollen in Zusammenarbeit mit unseren europäischen Partner*innen einen wach-
senden Teil der Produktionsprozesse von versorgungskritischen Gütern wie Me-
dikamenten oder Solarpanels in der Schweiz und im nahen Ausland ansiedeln. Dies
stärkt nicht nur die lokale Wertschöpfung, sondern reduziert auch Emissionen entlang
der Lieferketten.
4.2 BERUFSBILDUNG: FACHKRÄFTE FÜR DIE ÖKOLOGI-
SCHE WENDE
Der Ausbau der erneuerbaren Energien, die fortschreitende Digitalisierung und der steigende"
GPS,"Der Ausbau der erneuerbaren Energien, die fortschreitende Digitalisierung und der steigende
Pflegebedarf einer alternden Bevölkerung werden in den nächsten Jahren zehntausende
neue und wertvolle Arbeitsplätze schaffen. Besonders handwerkliche Berufe sind gefragt –
aber auch Berufe, die auf zwischenmenschlichen Beziehungen basieren, zum Beispiel in der
Pflege und Betreuung. Aber schon heute fehlen qualifizierte Fachkräfte. Darum ist es von
grosser Bedeutung, dass Menschen, die heute unterdurchschnittlich in den Arbeitsmarkt ein-
gebunden sind – konkret Frauen und Migrant*innen –, vermehrt gefördert werden.
20/34
Damit der soziale und ökologische Umbau gelingt, braucht es zwingend Weiterbildungs- und
Umschulungsprogramme. Sie sorgen dafür, dass die Fachkräfte der Zukunft rechtzeitig be-
reitstehen und unterstützen Menschen dabei, sichere Berufsperspektiven zu entwickeln. Da-
für müssen breit zugängliche Programme geschaffen werden, die insbesondere auch eine"
GPS,"für müssen breit zugängliche Programme geschaffen werden, die insbesondere auch eine
Umschulung auf Zukunftsjobs ermöglichen. Diesbezüglich hat die Schweiz noch Nachholbe-
darf: Das Weiterbildungssystem in der Schweiz ist heute vor allem auf die Höherqualifizie-
rung im angestammten Berufsfeld ausgerichtet.
In der nächsten Legislatur wollen wir Leute Folgendes erreichen:
• Wir entwickeln und unterstützen spezifische Aus- und Weiterbildungs- sowie Um-
schulungsprogramme im Energie-
, Bau- und Installationsgewerbe zur Bewälti-
gung der Energie- und Klimawende.
• Wir lancieren ein Bildungsgutscheinprogramm in der Höhe von 300 Millionen Fran-
ken. Bildungsgutscheine haben sich als wirksames Instrument erwiesen, um die Wei-
terbildungen zu fördern – gerade auch von älteren und bildungsärmeren Personen.
• Wir starten eine Ausbildungs- und Sensibilisierungsoffensive für mehr Frauen in
technologischen Berufen.
• Wir sorgen für eine deutliche Verbesserung der Arbeitsbedingungen in Pflege- und"
GPS,"• Wir sorgen für eine deutliche Verbesserung der Arbeitsbedingungen in Pflege- und
Betreuungsberufen sowie für eine höhere Vereinbarkeit von Berufs- und Familienle-
ben.
• Wir fördern die berufliche Integration von Geflüchteten, indem wir die Bewilli-
gungspflicht für die Erwerbstätigkeit von Asylsuchenden aufheben, sie bei der Diplo-
manerkennung unterstützen und indem wir ihre Aus- und Weiterbildung fördern. Auch
abgewiesene Asylsuchende sollen eine Arbeitserlaubnis erhalten.
• Wir veranlassen, dass die Regionalen Arbeitsvermittlungszentren 10'000 zusätzliche
Ausbildungszuschüsse sprechen. Damit ermöglichen sie das Nachholen einer
Grundbildung oder das Erlernen eines neuen Berufs.
4.3 NACHBARSCHAFT UND WOHNEN: GRÜN, VIELFÄLTIG
UND LEBENDIG
Der Boden ist eine wertvolle natürliche Ressource. Genau deshalb muss mit ihm sorgsam
umgegangen werden. Zahlreiche Gemeinden haben dies erkannt und setzen auf eine nach-"
GPS,"umgegangen werden. Zahlreiche Gemeinden haben dies erkannt und setzen auf eine nach-
haltige Raumplanung. Dank kurzen Wegen, genügend Grün- und Freiräumen und einer
nachhaltigen Zonenplanung entstehen Quartiere und Dörfer, in denen Nachbarschaft gelebt
und der persönliche Austausch und das Sich Aushelfen gepflegt wird. Städte und Dörfer sol-
len wieder zu Orten des Zusammenlebens werden, in denen die Bewohner*innen dank at-
traktiven und verkehrsberuhigten Aussenräumen gerne draussen verweilen.
Wir Leute streben durchmischte und vielfältige Quartiere und Dörfer an. Dafür braucht es
einen ausgewogenen Mix im Wohnangebot. Wohnbaugenossenschaften und weitere ge-
meinnützige Wohneigentümerschaften nehmen dabei eine wichtige Funktion ein, weil sie
zahlbare Mieten und eine effiziente Raumausnutzung garantieren und die Spekulation mit
Immobilien bremsen. Das gemeinnützige Wohnen ist insbesondere in Städten von grosser"
GPS,"Immobilien bremsen. Das gemeinnützige Wohnen ist insbesondere in Städten von grosser
Bedeutung, wo die Mieten explodieren und für Normalverdienende und Familien kaum mehr
zahlbare Wohnungen zu finden sind. Ein angemessenes und zahlbares Dach über dem Kopf
ist ein Menschenrecht.
21/34
In der nächsten Legislatur wollen wir Leute Folgendes erreichen:
• Wir werten Aussenräume ökologisch und sozial auf, beruhigen den Verkehr und ma-
chen sie barrierefrei. So werden unsere Quartiere und Dörfer attraktiver für Men-
schen und das Gewerbe.
• Wir unterstützen die lokale Wertschöpfung, insbesondere Bemühungen für eine lo-
kale und partizipative Sharing Economy.
• Wir sanieren Wohnungen energetisch, aber nicht zu Lasten der Mietenden. Energeti-
sche Sanierungen, welche durch öffentliche Gelder unterstützt werden, sind an die
Bedingung geknüpft, dass sie nicht zu weniger preisgünstigem Wohnraum führen.
• Wir sorgen dafür, dass die Seeufer in der Schweiz ökologisch aufgewertet und für"
GPS,"• Wir sorgen dafür, dass die Seeufer in der Schweiz ökologisch aufgewertet und für
Fussgänger*innen erschlossen werden. Dabei geniesst der Naturschutz höchste Pri-
orität.
• Wir fördern das gemeinnützige Wohnen, insbesondere in Genossenschaften. So
entsteht Wohnraum für kleine und mittlere Einkommen und eine soziale Durchmi-
schung, auch an begehrten Lagen.
• Wir stärken das Mietrecht mit Transparenz bei den Anfangsmieten und mit einem
besseren Kündigungsschutz bei Sanierungen. Ausserdem setzen wir uns für einfa-
chere Kontrollen und eine Begrenzung überhöhter Renditen ein.
4.4 NACHHALTIGE LAND- UND ERNÄHRUNGSWIRT-
SCHAFT
In den nächsten Jahren werden wichtige agrarpolitischen Weichen gestellt. Pestizide, Über-
düngung und Massentierhaltung haben die Bäuer*innen in eine Sackgasse geführt. Anstatt
die dringenden Reformen anzupacken, blockieren die bürgerlichen Parteien im Parlament
die nötigen Verbesserungen. Wir Leute engagieren uns für eine nachhaltige Land- und Er-"
GPS,"die nötigen Verbesserungen. Wir Leute engagieren uns für eine nachhaltige Land- und Er-
nährungswirtschaft. Es braucht rasche Antworten auf die globale Klimakrise, den überhöhten
Stickstoff- und Phosphorausstoss und den Rückgang der Biodiversität. Dazu müssen alle ge-
meinsam beitragen: die Produktion, die Verarbeitung, der Vertrieb und der Konsum. Vom
Acker bis zum Teller.
Um den Bäuer*innen eine Perspektive zu geben und den landwirtschaftlichen Angestellten
menschenwürdige Arbeitsbedingungen und Entlöhnung zu bieten ist eine bessere soziale
Absicherung, insbesondere für die Bäuerinnen, und mehr Schutz vor Dumpingpreisen durch
Importe nötig. Mit der «Fair-Food-Initiative» haben wir Leute eine innovative Lösung für
fairen Handel auf den Tisch gelegt. Ein Teil davon ist mit dem neuen Verfassungsartikel
104a «Ernährungssicherheit» in die Bundesverfassung aufgenommen worden.
Nachhaltige Ernährung ist auch gesunde Ernährung. In Schule und Ausbildung soll das Wis-"
GPS,"Nachhaltige Ernährung ist auch gesunde Ernährung. In Schule und Ausbildung soll das Wis-
sen über eine nachhaltige Ernährung gezielt gefördert werden. Auch die Deklaration von Le-
bensmitteln muss verbessert werden – nur so können sich Konsument*innen auch bewusst
für das beste und nachhaltigste Produkt entscheiden. Handlungsbedarf besteht vor allem bei
verarbeiteten Lebensmitteln. Gesunde und nachhaltig produzierte Lebensmittel sollen für alle
bezahlbar sein. Wichtig ist zudem die Reduktion von Lebensmittelverlusten (Food Waste).
Dadurch sinken die Lebensmittelkosten und die Umwelt wird geschont.
In der nächsten Legislatur wollen wir Leute Folgendes erreichen:
• Wir richten die Agrarpolitik auf eine umfassende Land- und Ernährungswirtschaft aus.
Die Agrarpolitik soll nachhaltige Produktionssysteme weiterentwickeln und stärker
verbreiten.
22/34
• Wir sorgen für die Stärkung regionaler Märkte mit saisonal produzierten Lebensmit-"
GPS,"22/34
• Wir sorgen für die Stärkung regionaler Märkte mit saisonal produzierten Lebensmit-
teln und Direktvermarktung. Das ist gut für Umwelt, Klima und das Portemonnaie von
Bäuer*innen und Konsument*innen.
• Wir fördern ausserfamiliäre Hofübergaben und erleichtern Menschen, die nicht aus
der Landwirtschaft kommen, den Zugang zu diesen Berufen und Betrieben. Wir set-
zen uns für neue Arbeitsorganisationen wie landwirtschaftliche Genossenschaften
oder solidarische Landwirtschaft ein.
• Wir sorgen für eine Verbesserung der sozialen Absicherung der Bäuerinnen. Sie
soll Bedingung für Direktzahlungen werden.
• Wir setzen uns für faire Preise für die Produzent*innen sowie für Preistransparenz
für Konsument*innen in Bezug auf die Margen ein.
• Wir stärken die Nachhaltigkeit in der landwirtschaftlichen Ausbildung und Bera-
tung.
• Wir fördern die klima-, umwelt- und tierfreundliche Lebensmittelproduktion durch eine
Umlagerung der Direktzahlungen. Der ökologische Leistungsnachweis (ÖLN) als"
GPS,"Umlagerung der Direktzahlungen. Der ökologische Leistungsnachweis (ÖLN) als
Voraussetzung für den Erhalt von Direktzahlungen ist anzupassen, etwa mit Vorga-
ben für den Einsatz von Pflanzenschutzmitteln und Düngern oder mit spezifischen
Anforderungen zum Schutz der Ökosysteme.
• Wir sorgen für mehr Investitionen in die Agrarforschung für die klimaschonende,
naturnahe und tierfreundliche Lebensmittelproduktion. Ein Schwerpunkt ist auf die Er-
forschung und Züchtung neuer, robuster, ökologischer Sorten zu legen, wofür sich
die Schweiz auch international engagieren soll.
• Wir verlängern das Gentechmoratorium und unterstellen neue Gentechmethoden
(«Genschere», CRISPR/Cas-Methode) dem Gentechgesetz.
• Wir deklarieren verarbeitete Lebensmittelprodukte besser in Bezug auf die Her-
kunft der Rohstoffe und die Folgen für die Gesundheit.
• Wir beenden die Massentierhaltung und setzen würdige Tierhaltungsstandards auf"
GPS,"• Wir beenden die Massentierhaltung und setzen würdige Tierhaltungsstandards auf
den Höfen in der Schweiz durch. Auch bei Importen ist das Tierwohl zu respektieren.
• Wir sorgen dafür, dass Fleischwerbung nicht mehr subventioniert wird und der
Fleischkonsum durch Bildung und bessere Information abnimmt.
• Wir stoppen die Lebensmittelverschwendung systematisch bei der Produktion,
beim Vertrieb, Verkauf und bei den Konsument*innen mittels Bildung, Ausbildung so-
wie Information und Sensibilisierung.
4.5 MOBILITÄT: KLIMAFREUNDLICH UNTERWEGS
Der Verkehr ist in der Schweiz der grösste Klimasünder. Während in allen anderen Berei-
chen die Klimabelastung sinkt, bleibt sie beim Verkehr auf dem Stand von 1990. Der Hand-
lungsbedarf ist entsprechend gross. Unnötiger Verkehr muss vermieden werden. Zu viele
Strassen zerschneiden heute Landschaften und heizen die Städte auf. Die Digitalisierung
hilft uns dabei, den Verkehr zu vermindern – etwa durch Homeoffice oder die Vereinfachung"
GPS,"hilft uns dabei, den Verkehr zu vermindern – etwa durch Homeoffice oder die Vereinfachung
von geteilten Mobilitätsangeboten.
Der verbleibende Individualverkehr sowie der Gütertransport müssen intelligent und umwelt-
freundlich abgewickelt werden. Das gelingt in erster Linie durch eine entschlossene Verlage-
rungspolitik auf effizientere und platzsparendere Verkehrsmittel. Es ist unsinnig, wenn zu
Spitzenzeiten nur eine Person im Auto unterwegs ist oder wenn jeder Kurierdienst mit dem
eigenen Lastwagen durch die Quartiere fährt. Ebenso unsinnig ist es, die kurzen Strecken in
Europa mit dem Flugzeug zurückzulegen. Dort, wo das Auto unersetzlich ist, müssen die
schweren Benzinschleudern schnellstmöglich mit leichten Elektroautos ersetzt werden.
23/34
Der Zugang zur Mobilität soll auch in Zukunft allen offenstehen. Insbesondere ländliche Re-
gionen müssen künftig besser mit dem öffentlichen Verkehr erschlossen werden. Das gilt vor"
GPS,"gionen müssen künftig besser mit dem öffentlichen Verkehr erschlossen werden. Das gilt vor
allem für Orte des Tourismus und der Freizeitgestaltung – denn fast die Hälfte der zurückge-
legten Autokilometer gehen auf das Konto des Freizeitverkehrs.
In der nächsten Legislatur wollen wir Leute Folgendes erreichen:
• Wir reduzieren den motorisierten Individualverkehr um 40 Prozent, durch die Er-
möglichung von Homeoffice, Städte der kurzen Wege sowie die Förderung des Fuss-
, Velo- und öffentlichen Verkehrs.
• Wir setzen uns für einen klimaneutralen, energieeffizienten und umweltfreundli-
chen Fahrzeugpark mit kleinen und leichten Autos ein. Dafür werden die Gewichts-
und Grössenlimite bei der Fahrzeugzulassung gesenkt, fossil betriebene Fahrzeuge
werden nicht mehr neu zugelassen.
• Wir machen die Logistik klimafreundlicher – dank einer Umsetzung des Verlage-
rungsziel für den alpenquerenden Güterverkehr, einem neuen Verlagerungsziel für"
GPS,"rungsziel für den alpenquerenden Güterverkehr, einem neuen Verlagerungsziel für
den Güterverkehr in der Fläche und der Förderung von City-Logistik-Konzepten.
• Wir sorgen für mehr Zug statt Flug. Dazu sind die internationalen Bahnverbindungen
auszubauen und das Ticketsystem zu vereinfachen. Zur Finanzierung soll eine Flugti-
cketabgabe erhoben werden. International soll sich die Schweiz für eine Besteuerung
von Kerosin einsetzen.
• Wir verbieten klimaschädliche Inlandflüge. In Zusammenarbeit mit unseren Nach-
barstaaten setzen wir uns für ein Verbot von Kurzstreckenflüge ins nahe Ausland ein.
• Wir unterstützen Mobilitätssharing-Angebote, zum Beispiel durch Bevorzugung von
Fahrgemeinschaften auf Parkplätzen und Strassen.
• Wir bauen Infrastruktur für den Fuss- und Veloverkehr aus und verbessern beste-
hende. Dazu gehören auch mehr Abstellplätze und sichere, getrennte Wege und der
Bau von Schnell- und Komfortrouten fürs Velo."
GPS,"Bau von Schnell- und Komfortrouten fürs Velo.
• Wir bauen die Strasseninfrastruktur für den motorisierten Verkehr nicht weiter aus
und prüfen punktuell den Rückbau. Bei den Nationalstrassen soll die betroffene Be-
völkerung verbindlich mitsprechen können.
• Wir bauen das Angebot des öffentlichen Verkehrs auf dem Land aus. Auch touristi-
sche öV-Angebote sollen vom Staat unterstützt werden.
• Wir führen ein faires und sozial gestaltetes Mobility Pricing ein, das zur Erreichung
der Klimaziele beiträgt. Durch gezielte Vergünstigung des öffentlichen Verkehrs soll
das Umsteigen attraktiver werden.
• Wir sorgen dafür, dass die gesetzlich vorgeschriebene Lärmschutzsanierung in den
Kantonen umgesetzt wird. Dazu soll innerorts generell Tempo 30 gelten und neu soll
der Bedarf für Tempo 50 innerorts besonders begründet werden.
• Wir bauen die Infrastruktur für Ladestationen aus, damit Elektrofahrzeuge zu
Hause, am Arbeitsplatz und unterwegs aufgeladen werden können.
5 FRIEDEN"
GPS,"Hause, am Arbeitsplatz und unterwegs aufgeladen werden können.
5 FRIEDEN
Wie gewährleisten wir Frieden und Demokratie in einer unsicheren Welt?
Frieden ist mehr als die Abwesenheit von bewaffneten Konflikten. Sicherheit ist mehr als die
Durchsetzung von Recht und Ordnung. Eine umfassende und nachhaltige Friedens- und Si-
cherheitspolitik anerkennt: Menschen fühlen sich sicher, wenn ihr Leben nicht in Gefahr ist –
24/34
sei es durch Krieg, Verfolgung, häusliche Gewalt, Klimakrise, Hunger oder mangelnde Ge-
sundheitsversorgung. Menschen wollen mitbestimmen über die Sicherung ihrer Lebens-
grundlagen – dafür braucht es einen starken Rechtsstaat und demokratische Mitsprache.
Ohne die Stabilisierung der Klimasysteme auf unserem Planeten verlieren wir unsere Le-
bensgrundlagen – die Bekämpfung der Klimaerhitzung und der von ihr ausgehenden Natur-
gefahren hat darum oberste Priorität, auch unter einem friedenspolitischen Aspekt."
GPS,"gefahren hat darum oberste Priorität, auch unter einem friedenspolitischen Aspekt.
Das grüne Rezept für Frieden muss mehr Demokratie, mehr soziale Gerechtigkeit und mehr
Rechtsstaat heissen. Diese wollen wir sichern, auch im digitalen Raum. Genauso wie auf
vertrauenswürdige politische Institutionen sind wir auf informierte Bürger*innen angewiesen,
welche geopolitischen Krisen wie Krieg und Klimaerhitzung erfolgreich begegnen können.
Darum braucht es starke und unabhängige Medien, um die komplexe Welt von heute verste-
hen und daraus bedeutsame Schlüsse ziehen zu können.
5.1 MEHR DEMOKRATIE WAGEN
Kaum ein anderes Land ist so stolz auf seine demokratischen Errungenschaften wie die
Schweiz. Aber die Demokratie in der Schweiz ruht sich auf ihren Traditionen aus. Es fehlt
seit Jahrzehnten der Mut, sie weiterzuentwickeln. Die Schweizer Demokratie schliesst heute
viel zu viele in der Schweiz lebende Menschen aus. Wir Leute sind überzeugt: Mehr Teil-"
GPS,"viel zu viele in der Schweiz lebende Menschen aus. Wir Leute sind überzeugt: Mehr Teil-
habe macht eine Demokratie stärker und zukunftsfähiger!
Junge Menschen, Ausländer*innen und behinderte Menschen brauchen mehr Mitbestim-
mungsrechte. Neue Demokratieformen sollen die bestehenden Prozesse ergänzen und
neuen Schwung in die Politik bringen. Auf teure und unsichere Experimente wie das E-Vo-
ting-Verfahren soll verzichtet werden. Stattdessen wollen wir die Demokratie dort digitalisie-
ren, wo ein echter Mehrwert für die Menschen und die Politik entsteht.
In der nächsten Legislatur wollen wir Leute Folgendes erreichen:
• Wir führen das Stimmrechtsalter 16 auf nationaler Ebene ein und stärken zusätzlich
die politische Bildung.
• Wir ermöglichen die demokratische Mitsprache von Ausländer*innen dank der Einfüh-
rung eines Ausländer*innenstimmrechts für alle, die seit drei Jahren rechtmässig in
der Schweiz wohnen."
GPS,"der Schweiz wohnen.
• Wir schaffen in den regulären demokratischen Institutionen Platz für neue Demokra-
tieformen, wie Bürger*innenräte. Die so erarbeiteten Ideen müssen in die politische
Entscheidungsfindung einfliessen.
• Wir ermöglichen durch digitale Tools vereinfachte und erweiterte demokratische Mit-
sprache in politischen Verfahren, beispielsweise durch kollaborative Vernehmlas-
sungsverfahren auf digitalen Plattformen.
• Wir vereinfachen es für Auslandschweizer*innen, ihre politischen Rechte wahrzu-
nehmen. Wir verschnellern ihren «Urnengang», indem der Prozess vollständig über
ausländische Botschaften und Konsulate läuft und kein Briefverkehr über die Schweiz
mehr nötig ist.
• Wir ermöglichen den Zugang zu den Daten der Plattformen, welche die digitale Öf-
fentlichkeit ausmachen. Forschung und Zivilgesellschaft können so sicherstellen,
dass wir wissen, wie sich Menschen informieren und wie die demokratische Mei-
nungsbildung beeinflusst wird."
GPS,"nungsbildung beeinflusst wird.
• Wir veranlassen in der Schweiz erste Versuche, um das Unterschriftensammeln voll-
ständig zu digitalisieren (E-Collecting). Diese ersten Schritte ermöglichen eine
25/34
Evaluation der Konsequenzen für die Schweizer Demokratie und eine daran ange-
passte Weiterentwicklung.
5.2 RECHTSSTAAT UND GOOD GOVERNANCE STÄRKEN
Das Rückgrat des friedlichen gesellschaftlichen Zusammenlebens ist der Rechtsstaat. Er ga-
rantiert die individuellen und kollektiven Rechte und Pflichten und gibt die Regeln zur gewalt-
freien Lösung von Konflikten vor. Der Rechtsstaat ist ein wichtiger Pfeiler im Gefüge der öf-
fentlichen Institutionen, denn er gewährt die Gewaltenteilung. Gleichzeitig muss die Gewal-
tenteilung nicht nur auf dem Papier existieren. Good Governance heisst: Transparenz, Effizi-
enz, Partizipation, Verantwortung werden gelebt und umgesetzt.
Für eine resiliente Gesellschaft in einem Zeitalter der Unsicherheit muss das Vertrauen in die"
GPS,"Für eine resiliente Gesellschaft in einem Zeitalter der Unsicherheit muss das Vertrauen in die
politischen und rechtsstaatlichen Institutionen der Schweiz gestärkt werden. Mit mehr Trans-
parenz in der Politikfinanzierung haben wir einen wichtigen Meilenstein erreicht, doch über
Lobbying, Finanzflüsse und das Verwaltungshandeln braucht es noch mehr Transparenz.
Auch müssen der Rechtsstaat und die politischen Institutionen weiterentwickelt, gestärkt und
mit den nötigen Ressourcen ausgestattet werden, um die Selbstbestimmung der Menschen
zu unterstützen, die Herausforderungen der Klimakrise zu meistern und die Chancen der di-
gitalen Technologien zu nutzen.
In der nächsten Legislatur wollen wir Leute Folgendes erreichen:
• Wir gehen die ersten Schritte hin zu einer öffentlichen Parteienfinanzierung – dies
stärkt die Parteien als wichtiges Standbein der Schweizer Demokratie und macht sie
resistenter gegenüber Beeinflussungsversuchen mit Geld."
