party,chunk
SVP,"Schweizer Boden betreten können;
● Unterbinden von Projekten wie rechtswidrige «City Cards» oder
ähnlichen «Ausweisen», welche verschiedene Städte einführen
wollen, um illegalen «Sans-Papiers» über die Hintertür einen legalen
Aufenthaltsstatus zu beschaffen.
Vorteile
Das bringt mir:
✔ als Mensch die Garantie, dass die Schweiz echten Verfolgten in Europa
Zuflucht bietet, getreu ihrer humanitären Tradition;
✔ als Steuerzahler mehr Geld im Portemonnaie durch Kosteneinsparun-
gen im Asylwesen und den verbundenen Sozialausgaben;
✔ als Bürger die Gewissheit, dass sich unser Staat von Wirtschaftsmig-
ranten nicht über den Tisch ziehen lässt;
✔ im Alltag mehr Sicherheit, weil sich betrunkenes Herumlungern sowie
Kleinkriminalität für Asylbewerber nicht mehr lohnt und Gewaltkrimi-
nalität hart bestraft wird;
✔ mehr Sicherheit, weil kriminelle Ausländer konsequent ausgeschafft
werden;
✔ eine Schweiz, die so bleibt, wie wir sie kennen und lieben.
Sicherheit, Recht
und Ordnung
Kriminelle"
SVP,"Sicherheit, Recht
und Ordnung
Kriminelle
hart anpacken
Die Schweiz gehörte einst zu den sichersten
Ländern der Welt. Eine verantwortungs-
lose Politik, eine inkonsequente Umsetzung der
bestehenden Gesetze sowie die Öffnung der
Grenzen durch den Beitritt der Schweiz zum
«Schengen»-Raum führten dazu, dass auch
unser Land von immer mehr Gewalt – vor allem
durch nicht integrierte Ausländer – geprägt ist.
In der Schweiz muss endlich wieder Sicherheit
herrschen, wir dürfen kein Eldorado für Krimi-
nelle sein. Eine effiziente Nulltoleranz-Praxis,
insbesondere bei Gewaltdelikten, mit spür-
baren Strafen und einem konsequenten
Straf vollzug, muss strikt durchgesetzt werden.
55
Deborah Isliker
Privatkundenberaterin Regionalbank
Importierte Gewalt führt
dazu, dass ich mich als
Frau zunehmend unsicher
fühle auf unseren Strassen.
Es ist höchste Zeit, dass Recht
und Ordnung wiederhergestellt
und kriminelle Ausländer
konsequent ausgeschafft
werden.
56"
SVP,"und Ordnung wiederhergestellt
und kriminelle Ausländer
konsequent ausgeschafft
werden.
56
S i c h e r h e i t , R e c h t u n d O r d n u n g
Eldorado der schweren Gewalt
Bis zur Corona-Pandemie 2019 wurden durchschnittlich
100 Einbrüche pro Tag begangen und das Total aller Gewalt-
straftaten pro 1000 Einwohnerinnen und Einwohner erhöhte
sich auf 5,3 Promille. Auffällig und speziell ist nun der Lock-
down-Effekt: Während des Corona-Jahres 2020 nahmen die
schweren Gewaltstraftaten, darunter die Vergewaltigungen,
markant zu. Die Vergewaltigungen nahmen 2021 nochmals
um 44 auf insgesamt 757 zu! Dies ist der höchste Wert der letz-
ten zehn Jahre! Aus Sicht der Partei besteht nach wie vor drin-
Entwicklung von Straftaten 2009 bis 2021
1’550
1’300
1’050
800
550
300
2009 2011 2013 2015 2017 2019 2020 2021
Schwere Körperverletzung Raub Vergewaltigung
gender Handlungsbedarf: Nebst abschreckenden Strafrahmen
(unbedingte Gefängnisstrafe bei verurteilten Vergewaltigern)"
SVP,"(unbedingte Gefängnisstrafe bei verurteilten Vergewaltigern)
ist unbedingt die Polizei zugunsten einer wirksamen Straf-
verfolgung mit genügend Mitteln zu stärken. Die Partei fordert
Opferschutz statt Täterschutz!
Cyberkriminalität den Stecker ziehen
Die während der Corona-Pandemie boomenden digitalen
Straftaten verteilen sich auf drei Bereiche: «Cyber-Wirt-
schaftskriminalität», «Cyber-Sexualdelikte» sowie «Cyber-
Rufschädigung und unlaute-
res Verhalten». Am stärksten
vertreten ist Cyberbetrug, ein
Teilbereich der Cyber-Wirt-
schaftskriminalität. Allein
im Jahr 2021 wurden von
der Polizei 30’351 Straftaten
mit einer digitalen Kompo-
nente registriert; das sind
24 Prozent mehr als 2020
und entspricht einem
Durchschnitt von 83 di-
gitalen Straftaten pro
Tag. Es gibt mittlerweile
Widerhandlungen, welche
überwiegend «digital» verübt
werden, so z. B. Datenbeschä-
digung, Pornografie, Geld-
Quelle: BFS – STAT-TAB
wäscherei und Betrug. 2021 haben alleine im digitalen Bereich"
SVP,"Quelle: BFS – STAT-TAB
wäscherei und Betrug. 2021 haben alleine im digitalen Bereich
innerhalb eines Jahres die Erpressung um 83 Prozent und der
Betrug um 27 Prozent zugenommen! Aus Sicht der Partei ist die
stark wachsende Bedrohung unserer Bevölkerung im Bereich
der Cyberkriminalität ohne Wenn und Aber zu bekämpfen.
Es ist höchste Zeit, mit geeigneten Massnahmen die Rechts-
sicherheit im digitalen Raum zu gewährleisten, um so mit
dem raschen kriminellen Strukturwandel in Zukunft mit-
halten zu können.
Kuscheljustiz beenden
Dass es Ersttäter gibt, wird man nie ganz verhindern können.
Für Wiederholungstäter aber tragen Politik und Justiz die
Mitverantwortung. Im offenen Strafvollzug und bei der
laschen Urlaubspraxis gibt es immer wieder tödliche Fehl-
beurteilungen, wobei am Schluss niemand zuständig sein
will. Auch nach Entlassung aus der Haft kommt es zu Rück-
fällen (2018 waren es 19,6 Prozent). Insbesondere rückfall-
gefährdete Mörder, Vergewaltiger und Pädophile gehören in"
SVP,"gefährdete Mörder, Vergewaltiger und Pädophile gehören in
Verwahrung. Der Schutz der Gesellschaft ist höher zu ge-
wichten als eine allfällige Heilung der Intensivtäter. Ohnehin
hat sich bei den in- und ausländischen Kriminellen bereits
herumgesprochen: In der Schweiz gibt es viel zu holen. Und
wird man einmal erwischt, erhält man aufgrund unserer
milden Rechtsprechung eine geringe Bestrafung, vielfache
Ein sprachemöglichkeiten und vergleichsweise luxuriöse Ge-
fängnisse. Fussball- und Tennisplätze, Fitness-Studios und
Hallenbäder gehören oft zum Standard. Und ausserdem Ker-
S i c h e r h e i t , R e c h t u n d O r d n u n g 57
zenziehen, Silbergiessen, therapeutisches Musizieren, Fern-
sehen und mehrmals täglich eine reiche Menüauswahl (vom
muslimischen bis zum vegetarischen Menü). Müssen wir uns
wundern, wenn der heutige Strafvollzug die Steuerzahler
dank der integrativen Kuscheljustiz jährlich rund eine Mil-
liarde Franken kostet?
Schweiz als Mekka der ausländischen Kriminellen"
SVP,"liarde Franken kostet?
Schweiz als Mekka der ausländischen Kriminellen
Kriminelle Clans, Banden, Verbrecher und Terroristen: Selbst
bei schweren Straftaten gelingt es immer noch nicht, Täter mit
Migrationshintergrund konsequent auszuweisen. Der Euro-
päische Gerichtshof für Menschenrechte hat bereits entschie-
den, dass die Schweiz einen verurteilten Vergewaltiger nicht
ausweisen darf. Ein ähnliches Urteil wurde bei einem Schläger
aus Deutschland gefällt. Für die Partei sind diese und ähnliche
Urteile absolut inakzeptabel. Wie lange müssen wir uns sol-
chen Unfug noch zumuten? Die Partei fordert, dass die Aus-
schaffung krimineller Ausländer konsequent umgesetzt wird,
so wie es das Volk mit der Ausschaffungsinitiative bestimmt
hat. In der Schweiz hat wieder unser Verfassungsrecht zu gel-
ten! Die Übervertretung von straffälligen Ausländern in Kom-
bination mit der vorherrschenden Kuscheljustiz ist die Folge
der Masseneinwanderung und der verfehlten Asyl politik."
SVP,"der Masseneinwanderung und der verfehlten Asyl politik.
70 Prozent aller Insassen von Haftanstalten sind Ausländer,
49 Prozent der Untersuchungshäftlinge sind «Sans-Papiers».
In 42 Prozent aller Fälle wurde die sogenannte «Härtefall-
klausel» ausgerufen, das heisst, die Kriminellen wurden trotz
Verfassungsauftrag nicht ausgeschafft. Dies ist unhaltbarer
58
S i c h e r h e i t , R e c h t u n d O r d n u n g
Täterschutz statt Opferschutz – obwohl die anderen Parteien
eine «pfefferscharfe» Umsetzung der Ausschaffungsinitiative
versprochen hatten.
Jünger, gewalttätiger, skrupelloser
Die Partei fordert dringend eine Verschärfung des Jugend-
strafrechts. Denn auch die Jugendkriminalität und Jugend-
brutalität zeigen leider eine bedenkliche Entwicklung. Im Jahr
2021 wurden 8’578 Jugendurteile aufgrund von Widerhand-
Verurteilungen und Verurteilte
für ein Vergehen oder Verbrechen
55’000
45’000
35’000
2008 2010 2012 2014 2016 2018 2019 2020 2021
Schweizer Ausländer (25,7 % Bevölkerung)"
SVP,"45’000
35’000
2008 2010 2012 2014 2016 2018 2019 2020 2021
Schweizer Ausländer (25,7 % Bevölkerung)
Quelle: BFS. Strafurteilsstatistik (SUS), 2022
lungen gegen das Strafgesetzbuch ausgesprochen, das sind
6,4 Prozent mehr als im Vorjahr. Dieser Wert hat seit 2018
stark zugenommen (+27,5 Prozent im Zeitraum 2018–2021).
Betrachtet man ausschliesslich die Gewaltstraftaten, ist eine
ähnliche Tendenz auszumachen. Zwischen 2018 und 2021
sind sie um 37,2 Prozent gestiegen. Strafbare Handlungen
gegen die sexuelle Integrität haben sich innerhalb von drei
Jahren verdoppelt (2018: 419 Straftaten; 2021: 837). Beim
allergrössten Teil der jungen Täter handelt es sich um Aus-
länder oder um Jugendliche
mit Migrationshintergrund.
Die lasche, von links-grünen
Richtern geprägte Rechtspre-
chung löst auch hier kein Pro-
blem. Busse und Freiheits-
entzug können erst ab einem
Alter von 15 Jahren verhängt
werden. Aus Sicht der Partei
haben die Jugend gerichte den
Straf rahmen auszunutzen"
SVP,"werden. Aus Sicht der Partei
haben die Jugend gerichte den
Straf rahmen auszunutzen
sowie das Erwachsenenstraf-
recht bei besonders schwe-
ren Delikten bereits ab dem
vollendeten 16. Altersjahr
anzuwenden. Vor allem soll-
ten jugendliche Straftäter die
Konsequenzen ihres Fehlver-
haltens un mittelbar spüren.
Standpunkte
Die Partei …
● setzt sich für den Rechtsstaat und die Rechtssicherheit aller Bürgerin-
nen und Bürger ein;
● fordert, dass die Interessen der Opfer konsequent höher gewichtet
werden als jene der Täter;
● steht dafür ein, dass sich Kinder, Frauen und Männer im öffentlichen
Raum sicher fühlen können;
● fordert insbesondere die konsequente Umsetzung von Recht und
Ordnung bei Nichtintegrierbaren;
● setzt sich konsequent für Massnahmen gegen häusliche Gewalt ein
und fordert insbesondere Massnahmen gegen häusliche Gewalt durch
Nichtintegrierbare und durch Personen aus anderen Kulturkreisen;
● verlangt Nulltoleranz und härtere Strafen bei Gewalt und Drohung"
SVP,"● verlangt Nulltoleranz und härtere Strafen bei Gewalt und Drohung
gegen Behörden und Beamte. Zudem sollen auch Gaffertum, Pöbe-
leien und andere Behinderungen der Sicherheits- und Rettungskräfte
bestraft werden können;
● fordert, dass für die Sicherheit der Bevölkerung schnell und konse-
quent gegen Gewaltstraftäter vorgegangen wird;
● fordert die Erhöhung des Mindeststrafmasses bei Delikten an Leib
und Leben und dass die Richter den Spielraum für längere Strafen des
Strafgesetzbuches auch nutzen;
● fordert für verurteilte Vergewaltiger unbedingte Gefängnisstrafen;
● verlangt ein Strafregister, in dem schwere Straftaten nicht gelöscht
werden, damit Wiederholungstaten verhindert werden können;
● unterstützt eine Verschärfung der Urteile und schnelles Handeln der
Gerichte insbesondere im Jugendstrafrecht;
● verlangt ein Umdenken im Strafvollzug: weniger Therapie, mehr
Arbeit und Beteiligung an den verursachten Kosten;
S i c h e r h e i t , R e c h t u n d O r d n u n g 59"
SVP,"S i c h e r h e i t , R e c h t u n d O r d n u n g 59
● will, dass bei Kriminalstatistiken des Bundes Nationalitäten sowie
Migrationshintergrund ausgewiesen werden;
● fordert, dass das «Schengen»-Abkommen von Staaten mit «Schen-
gen»-Aussengrenzen konsequent angewendet wird;
● fordert, dass die Schweiz im Rahmen des «Schengen»-Vertrages von
ihrem Recht Gebrauch macht, Grenzkontrollen wieder einzuführen,
um die Einreise von illegalen Einwanderern und Kriminaltouristen zu
verhindern;
● fordert, dass das «Dublin»-Abkommen konsequent von allen teilneh-
menden Ländern umgesetzt wird;
● fordert die konsequente Anwendung des Nachrichtendienstgesetzes
bei der Bekämpfung des Terrorismus und der Cyberkriminalität.
Vorteile
Das bringt mir:
✔ als Bürger Sicherheit vor Einbrüchen und Diebstählen;
✔ als Jugendliche weniger Anmache und Pöbeleien im Ausgang;
✔ als Frau ein Gefühl der Angstfreiheit, wenn ich, meine Töchter,
meine Familie oder Bekannte sich im öffentlichen Raum bewegen;"
SVP,"meine Familie oder Bekannte sich im öffentlichen Raum bewegen;
✔ als Opfer von Gewalt und von häuslicher Gewalt die Gewissheit,
dass die Täter hart bestraft werden;
✔ griffige Rechtsgrundlagen, um bei Verbrechen auch wirklich
durchgreifen zu können.
Armee
Wiederaufbau der
Verteidigungsfähigkeit
Sicherheit ist eine unverzichtbare Voraus-
setzung für Freiheit, Unabhängigkeit und
Wohlstand, gerade in einer Welt, die immer un-
berechenbarer wird. Konventionelle Kriege sind
zurück auf der politischen Agenda und Terror-
anschläge sind jederzeit möglich. Die Armee
ist über die letzten Jahrzehnte kaputtgespart
worden und nicht mehr verteidigungsfähig.
Wir sind verpflichtet, auch in Zukunft die nötigen
Mittel für unsere Armee und die Landesvertei-
digung bereitzustellen – damit die Menschen
in der Schweiz in Sicherheit und Freiheit leben
können.
61
Sébastien Bossel
Rechtsanwalt
Bewaffnete Konflikte
nehmen zu und in
Europa herrscht wieder
Krieg. Eine starke, einsatz-
fähige und gut ausgerüstete"
SVP,"nehmen zu und in
Europa herrscht wieder
Krieg. Eine starke, einsatz-
fähige und gut ausgerüstete
Armee ist deshalb
elementar, um unserem
Land Frieden, Freiheit
und Sicherheit zu
garantieren.
62
A r m e e
Die Welt wird gewalttätiger
Die Welt erlebt eine Welle von bewaffneten Konflikten, wie
es sie seit Ende des Kalten Krieges nicht mehr gegeben hat.
Die Zahl von Konflikten steigt auf der Welt und die Weltge-
meinschaft hat keine Lösung, um diese Gewaltspirale zu stop-
pen. Gerade während weltweiter Krisen, wie z. B. während der
Corona-Pandemie, steigt die Zahl von bewaffneten Konflik-
ten. Es ist nur eine Frage der Zeit, bis andere Krisen oder die
ungebremsten Migrationsströme die nächste Konfliktspirale
lostreten. Die Schweiz lebt scheinbar komfortabel auf einer
Insel inmitten des sich in Sicherheit wägenden Europas. Eine
Annahme, welche falscher nicht sein kann, wenn man über die
Bewaffnete Konflikte auf der Welt
60
50
40
30
20
10
Europa
Naher Osten
Asien
Afrika
Nord- und
Südamerika
0"
SVP,"60
50
40
30
20
10
Europa
Naher Osten
Asien
Afrika
Nord- und
Südamerika
0
2002 2007 2012 2013 2014 2015 2016 2017 2018 2019 2020 2021
Quelle: Uppsala Conflict Data Program (UCDP)
Grenzen unserer westlichen Wohlfühlblase hinausschaut. Der
Frieden in Europa ist ein künstliches Konstrukt und könnte
unter Umständen schnell zusammenbrechen. Es ist deshalb
zentral, eine starke Armee zu unterhalten, welche auf alle
sicherheitspolitischen Eventualitäten vorbereitet und in
kurzer Zeit vollständig einsatzbereit ist.
Moderne Konflikte sind komplizierter
Moderne Konflikte sind vielschichtig und finden gleichzeitig
auf verschiedenen Ebenen statt. Ein moderner Konflikt kann
gleichzeitig auf dem Boden, in der Luft, auf dem Wasser, im
Weltraum, aber auch mit elektromagnetischen und cyber-
Mitteln ausgetragen werden, begleitet von grossen psychologi-
schen Meinungsbeeinflussungskampagnen und verschiedenen
Phasen von Entspannung und Eskalation – wie der Konflikt"
SVP,"Phasen von Entspannung und Eskalation – wie der Konflikt
zwischen der Ukraine und Russland seit 2014 zeigt. Konflikte
können aber auch auf einzelne Ebenen fokussiert stattfinden.
Es ist deshalb notwendig, dass eine Armee auf allen Ebenen
vollständig ausgerüstet, ausgebildet und alimentiert ist und
jederzeit auf den schlimmsten Fall vorbereitet ist. Um solche
Bedrohungen zu erkennen, sich darauf vorzubereiten und das
Vorgehen von Staaten in Konflikten zu verstehen, sind der jah-
relang vernachlässigte Militärische Nachrichtendienst (MND)
und der Dienst für präventiven Schutz der Armee (DPSA)
als Institutionen zu stärken.
Neutralität als Sicherheitsmaxime
Die Weltordnung, die sich nach dem Ende des Kalten Krieges
A r m e e 63
entwickelt hat, gehört der Vergangenheit an. Wir leben heu-
te in einer Welt, in der es mehrere starke Grossmächte gibt.
Die Schweiz als Kleinstaat steht vor einer wichtigen Entschei-
dung: entweder sich einem Lager von Grossmächten anzu-"
SVP,"dung: entweder sich einem Lager von Grossmächten anzu-
schliessen und einen Teil ihrer Souveränität aufzugeben oder
den traditionellen Weg der Neutralität weiterzugehen und in
Frieden mit allen Staaten zu leben. Die Geschichte zeigt, dass
neutrale Staaten nur dann ernst genommen wurden, wenn
diese ihre Neutralität glaubhaft nach aussen verteidigen konn-
ten. Die Partei steht daher vollumfänglich hinter der integralen,
immerwährenden und bewaffneten Neutralität der Schweiz
64
A r m e e
Luftraum: der Raum zwischen Erdoberfläche und
Weltraum; er unterliegt nationaler Hoheit
Weltraum: Dort stationierte Satelliten dienender
Kommunikation sowie der Nachrichten beschaffung und
Frühwarnung. Der Weltraum ist völkerrechtlich hoheitsfrei.
Informationsraum: Darin werden
Informationen zwischen Personen
ausgetauscht, z. B. in Medien oder im
öffentlichen Raum.
Cyber-Raum: der virtuelle Raum, in dem
elektronische Daten erfasst, gespeichert,
übertragen und verarbeitet werden."
SVP,"elektronische Daten erfasst, gespeichert,
übertragen und verarbeitet werden.
Elektromagnetischer Raum: Raum, in
dem sich elektromagnetische Wellen
ausbreiten und in dem Geräte eingesetzt
werden, die diese Wellen nutzen
(z. B. Funkgeräte, Telefone).
Boden: Der Raum, in dem die Bevölkerung lebt.
Alle anderen Wirkungsräume haben Einfluss auf diesen Raum.
Maritimer Raum: Die Weltmeere, die zusammen
über 70 % der Erdoberfläche bedecken.
Quelle: VBS, Zukunft der Bodentruppen 2019, S. 19
und lehnt jegliche militärischen Verpflichtungen gegenüber
anderen Ländern und internationalen Institutionen, wie z. B.
der NATO, ab. Dazu gehört auch, dass die Schweiz ihre 195
Soldaten aus dem kostspieligen, bewaffneten und von der
NATO geführten Auslandseinsatz im Kosovo so rasch als
möglich abzuziehen hat.
Eigenständige Verteidigung
Die Schweiz gehört den Schweizern und wird im Ernstfall
durch Schweizer Soldaten verteidigt. Die Partei fordert daher
den raschen Wiederaufbau der verlorenen Verteidigungsfä-"
SVP,"den raschen Wiederaufbau der verlorenen Verteidigungsfä-
higkeit der Schweizer Armee. Aufgeschreckt durch den Uk-
raine-Krieg ist nun auch die links-grüne Verteidigungspolitik
der Schweiz aus ihrer naiven Vorstellung vom Ausbruch des
totalen Weltfriedens nach dem Ende der Sowjetunion aufge-
wacht und hat dem jahrzehntelangen Totsparen der Armee
kurzfristig ein Ende bereitet. Die Partei fordert jedoch, die Spar-
politik in der Armee nachhaltig zu beenden. Die Armeeaus-
gaben sind dauerhaft an das Bruttoinlandprodukt zu koppeln,
um eine konsistente Sicherheitspolitik zu garantieren. Die als
«Kompetenzerhaltung» schöngeredete Mangelwirtschaft in
der Armee ist sofort zu beenden.
Gut ausgerüstete Soldaten
Die Partei fordert eine vollständige materielle Ausrüstung für
die gesamte Armee inklusive Reservematerial, mit dem ein
Drittel von Umlaufreserve und Materialausfällen sofort kom-
pensiert werden kann. Wichtige Teile der Kampfkraft der
A r m e e 65"
SVP,"pensiert werden kann. Wichtige Teile der Kampfkraft der
A r m e e 65
Schweizer Armee liegen heute in Trümmern: Die Luftwaf-
fe ist knapp gross genug für Luftpolizeidienste, die Artillerie
ist veraltet, sichere Verlegungen von Soldaten können nicht
gewährleistet werden, eine effiziente Aufklärung ist nicht
möglich und es gibt nicht genügend Kampfpanzer. Zudem
wächst die armeeinterne Bürokratie im gleichen Mass, wie
die Armee Kompetenzen verliert. Die Armee ist ungenügend
ausgerüstet und alimentiert. Sie muss rasch wieder vertei-
digungsfähig gemacht werden. Die Partei fordert eine Armee,
welche schnell und flexibel eingesetzt werden kann, modern
ausgerüstet und gut ausgebildet und gross genug ist, um einen
Gegner davon abzuhalten, unser Land anzugreifen.
66
A r m e e
Bürger in Uniform
Der Bürger ist das Rückgrat der Schweizer Armee. Aufgrund
der seit Jahrzehnten rückläufigen Geburtenrate und der kons-
tanten strukturellen Schwächung der Armee durch links-grüne"
SVP,"tanten strukturellen Schwächung der Armee durch links-grüne
Kreise können die Armeebestände auf Dauer nicht garantiert
werden. Linke Armeeabschaffer haben die Bestände laufend
gekürzt und gleichzeitig die Hürden zum vorzeitigen Aus-
scheiden aus der Armee massiv gesenkt, wie zum Beispiel die
Abschaffung der Gewissensprüfung als Vorbedingung für den
Zivildienst im Jahr 2009. Die Sicherung der Armeebestände
darf nicht auf dem Rücken der Soldaten ausgetragen werden.
Forderungen, dass die Dienstzeit der Soldaten verlängert wer-
den soll, um die Bestände zu sichern, bestrafen die Soldaten.
Die Partei fordert vielmehr, dass der Zivildienst und Zivilschutz
zu einem Dienst zusammengelegt werden, die Hürden für den
Übertritt aus der Armee erhöht werden und, dass die Bestände
dieses Dienstes nach oben gedeckelt werden. Die Zivilbevölke-
rung muss zudem vermehrt mit der Armee in Kontakt treten,
die Partei fordert dazu konkrete Massnahmen, um das Image"
SVP,"die Partei fordert dazu konkrete Massnahmen, um das Image
der Armee in der Bevölkerung zu verbessern und die Armee
besser lokal zu verankern. Dazu zählen zum Beispiel eine
erhöhte Sichtbarkeit der Armee im Alltag und das verstärkte
Abhalten von WKs (Wiederholungskursen) in Dörfern.
Einsatzbereit und flexibel einsetzbar
Die Schweizer Armee muss wieder verteidigungsfähig wer-
den. Die Partei fordert in einem ersten Schritt die Mindestbe-
stände bis 2025 zu garantieren, in einem weiteren Schritt den
Soll bestand bis 2027 auf 120’000 Soldaten zu erhöhen und in
einem dritten Schritt aufzuzeigen, wie die Schweizer Armee ab
2027 auf einen Sollbestand von mindestens 180’000 Mann an-
gehoben werden kann. Weiter muss die Armee die zielgerich-
tete Nutzung von zivilem Wissen nach dem Milizprinzip si-
cherstellen, die Einteilung der Armeeangehörigen regelmässig
überprüfen und die Fähigkeiten der Armee auf die schlimms-
te Lageentwicklungsmöglichkeit ausrichten. Situationen wie"
SVP,"te Lageentwicklungsmöglichkeit ausrichten. Situationen wie
beim Assistenzdienst während der Corona-Pandemie, als fast
alle in die Armee eingeteilten Pflegefachpersonen durch das
Armeeaufgebot vorübergehend in ihren dringend benötig-
ten Arbeitsorten in den zivilen Spitälern fehlten, dürfen sich
nicht wiederholen! Die Partei fordert strukturelle Anpassungen,
welche ziviles Fachwissen nicht nur zielgerecht, sondern auch
nach logischen Einsatzszenarien einbindet.
Standpunkte
Die Partei …
● bekennt sich zu einer hervorragend ausgebildeten Milizarmee und
zur allgemeinen Wehrpflicht;
● setzt sich für eine Erhöhung der Zahl der Angehörigen bei den
Kampftruppen ein;
● setzt sich ein für eine vollständige Ausrüstung der Armee mit zeit-
gemässen Systemen und den raschen Ersatz von veraltetem Material
in allen Bereichen;
● fordert die Erhöhung des Armeebudgets auf mindestens 1 Prozent des
Bruttoinlandprodukts (BIP), aber mindestens 7 Milliarden jährlich;"
SVP,"Bruttoinlandprodukts (BIP), aber mindestens 7 Milliarden jährlich;
● fordert eine moderne Armee, die sich den Herausforderungen der Zeit,
insbesondere im Bereich der Cybersicherheit, hybriden Kriegsführung
und konventionellen Kriegsführung schnell anpassen kann;
● verlangt, dass alle grossen Verbände der Armee vor allem auf die
Fähigkeit zur Landesverteidigung gemäss Verfassungsauftrag aus-
gerichtet werden und sekundär mit Teilen subsidiäre Schutz- und
Unterstützungsaufgaben wahrnehmen können;
● setzt sich für den Erhalt eines eigenständigen liberalen Waffenrechts
inkl. der Abgabe von Taschenmunition als Teil der persönlichen Aus-
rüstung der Soldaten ein;
● steht für eine bündnisfreie Schweiz und keine weitere Einbindung in
die NATO ein;
● fordert einen effizienten und modernen militärischen Nachrichten-
dienst, der satellitengestützte Aufklärung betreibt, Konflikte und an-
dere potenzielle Bedrohungen für die Schweiz analysieren kann sowie"
SVP,"dere potenzielle Bedrohungen für die Schweiz analysieren kann sowie
daraus Konsequenzen für die Schweizer Armee und die Sicherheit des
Landes ziehen kann;
A r m e e 67
● fordert in einem ersten Schritt die Sicherung der Bestände der Armee
sowie in einem weiteren Schritt die Erhöhung des Sollbestandes der
Armee um mindestens 20’000 Angehörige;
● fordert den Aufbau einer glaubwürdigen Luftsicherung, bestehend aus
einer flächendeckenden Ausrüstung der Armee mit Luftabwehrwaffen
und den Einsatz von moderner Drohnentechnologie;
● verlangt die Beendigung von bewaffneten Auslandeinsätzen wie
demjenigen im Kosovo;
● fordert eine ausgewogene Präsenz der Armee in allen Regionen der
Schweiz;
● fordert, dass der Zivildienst abgeschafft wird und Zivildienstleistende
neu in den Zivilschutz eingeteilt werden.
Vorteile
Das bringt mir:
✔ als Bürger mehr Sicherheit;
✔ als Familie die Gewissheit, dass unsere Bevölkerung und unser Land
geschützt werden können;"
