party,chunk
FDP,"werden. Dabei stehen nicht einzelne Technologien im Vordergrund, sondern der Ideenwettbewerb. Alternative
Treibstoffe oder die Elektrifizierung des Strassenverkehrs werden rascher verbreitet, wenn die dafür nötige
Infrastruktur (Ladestationen, Wasserstoff-Tankstellen, Produktion und Verteilung alternativer Treibstoffe etc.)
und modernisierte Verkehrsdienstleistungen (z.B. Transporte «on demand») zur Verfügung stehen. Öffentliche
Parkplätze und Mehrfamilienhäuser (z.B. mit Anreizsystem zur Installation) sollen mit Ladestationen
ausgestattet werden. Hierzu gilt es die Regulierungskompetenzen zu klären, da bei Bund und Kantonen
Nachholbedarf besteht. Durch verkehrstechnische oder bauliche Massnahmen in Städten und
Agglomerationen, z.B. zugunsten von elektrischen oder wasserstoffbetriebenen Fahrzeugen, kann die CO2-
arme Mobilität zusätzlich unterstützt werden.
› Verkehrsfluss verbessern: Die Verkehrsauslastung im öffentlichen und privaten Verkehr soll durch den"
FDP,"Einsatz von digitalen Anwendungen verbessert werden (intelligente Verkehrsleitsysteme,
Echtzeitinformationen zu Stau- oder Parksituationen etc.). So kann der Verkehr reduziert und flüssig gehalten
werden. Dies senkt den CO2-Ausstoss. Der Verkehrsfluss soll zudem durch den Abbau von staatlich
finanzierten, ineffizienten Systemen verbessert werden. Mitfahrangebote und andere auslastungssteigernde
Lösungen, z.B. im öffentlichen Verkehr, müssen in Verkehrskonzepte miteinbezogen werden. Regulierungen
für innovative Verkehrsdienstleistungen müssen abgebaut bzw. erst gar nicht postuliert werden. Um die
Nutzung des ökologisch sinnvollen Langsamverkehrs attraktiver zu machen, sind E-Bikes, E-Scooter, Velos
etc. besser in den Gesamtverkehr zu integrieren. Dafür braucht es langfristige Gesamtkonzepte.
› Zukunftsfähige Mobilität realisieren: Anhand von Pilotregionen soll aufgezeigt werden, wie in Zukunft"
FDP,"autonomer und CO2-freier Verkehr gelenkt und umgesetzt werden kann. Im Rahmen von öffentlich und privat
finanzierten Projekten (PPP) wird unter Beizug von ETH, Universitäten, Fachhochschulen und Industrie die
zukünftige Mobilität simuliert und auf hiesige Verhältnisse angepasst. Privatpersonen und Organisationen
können sich mit Teilen, Miete oder Kauf von Mobilitätsleistungen daran beteiligen. Die Finanzierung gewisser
Infrastrukturen erfolgt durch das Treibstoffkompensationsprogramm.
› Transparenz im Flugverkehr erhöhen: Wer das Flugzeug wählt, muss genaue Informationen darüber
erhalten, wie viel CO2 er / sie auf der Flugreise ausstösst. Die Emissionsmenge pro Flug wird durch den
Einbezug in das europäische Emissionshandelssystem und das internationale Kompensationssystem
Seite 7
CORSIA bereits erfasst. Diese sollen für den Endkonsumenten ebenfalls ersichtlich sein. Zur Vereinfachung
wäre beispielsweise die Angabe eines Vergleichs mit anderen Verkehrsmitteln denkbar. Solche"
FDP,"wäre beispielsweise die Angabe eines Vergleichs mit anderen Verkehrsmitteln denkbar. Solche
Transparenz ermöglicht den Flugpassagieren eine schnellere und bessere Entscheidungsgrundlage, ob das
Flugzeug das richtige Verkehrsmittel ist.
4.2 Lenkung
› CO2-Zielwerte für fossile Verkehrsträger: Wie in der Energiestrategie 2050 festgelegt, sollen CO2-Zielwerte
für Personen- und Lieferwagen gemäss der Senkungsrate der EU weitergeführt werden. Die durchschnittlichen
netto CO2-Emissionen der Neuwagenflotte müssen kontinuierlich auf ein tieferes Niveau sinken und so den
Anreiz verstärken, verbrauchsärmere und effizientere sowie mit erneuerbaren Treibstoffen betriebene
Motoren zu nutzen. Bei Verfehlen der Zielwerte sind dem Vergehen angepasste Sanktionierungen
einzuführen.
› Gesamtkonzept für Abgaben auf Treibstoffe: Das Verursacherprinzip muss im Schienen- und
Strassenverkehr mehr zum Tragen kommen. Darum braucht es einerseits eine Lenkungsabgabe auf fossilen"
FDP,"Strassenverkehr mehr zum Tragen kommen. Darum braucht es einerseits eine Lenkungsabgabe auf fossilen
Treibstoffen wie Benzin und Diesel. Die Festlegung der Lenkungsabgabe muss die Preisniveaus des
benachbarten Auslandes beachten (Tanktourismus vermeiden). Die Umsetzung soll stufenweise erfolgen, um
die CO2-Grenzwerte und die Reduktionsziele für den Verkehr erreichen zu können. Bestehende Abgaben
wie die Mineralölsteuer sind in die Überlegungen miteinzubeziehen, damit die Finanzierung der
Verkehrsinfrastruktur weiterhin sichergestellt wird. Die Lenkungsabgabe und die nötige Rückverteilung ist
in ein Gesamtkonzept einzubetten, das auch die regional unterschiedlichen Abhängigkeiten vom
Individualverkehr berücksichtigt. Andererseits muss auch der Schienenverkehr z.B. im Rahmen der
Implementierung eines verkehrsträgerübergreifenden Mobility Pricing in ein solches Gesamtkonzept
miteinbezogen werden. Kantonale Motorfahrzeugsteuern sind zwecks Kostenwahrheit vermehrt auf Gewicht"
FDP,"miteinbezogen werden. Kantonale Motorfahrzeugsteuern sind zwecks Kostenwahrheit vermehrt auf Gewicht
und CO2-Emissionen auszurichten.
› Lenkungsabgabe auf Flugzeugtickets für Innovation und Klimaschutz: Das Verursacherprinzip muss
auch beim Luftverkehr zum Tragen kommen. Darum braucht es eine Lenkungsabgabe auf Flugtickets. Der
Ertrag fliesst teilweise in einen Klima-Fonds, aus welchem Mittel für Innovationen und für Klimaschutz-
Investitionen im In- und Ausland gesprochen werden können. Der Rest des Ertrags wird rückverteilt.
Transitpassagiere sollen von der Abgabe ausgenommen werden. Zudem soll sich die Schweiz gleichzeitig für
eine international koordinierte Besteuerung von Kerosin einsetzen, welche die Flugticketabgabe dann ablösen
soll. Der Luftverkehr muss schliesslich in das internationale Emissionshandelssystem der EU und das
internationale Kompensationsinstrument CORSIA eingebunden werden. Damit keine Doppelzählungen"
FDP,"internationale Kompensationsinstrument CORSIA eingebunden werden. Damit keine Doppelzählungen
entstehen, muss eine enge Koordination zwischen den Systemen stattfinden und die Anrechenbarkeit
ermöglicht werden.
Verabschiedet am 04.03.2017 von der Delegiertenversammlung der Die Partei.Die Liberalen
Für wettbewerbsfähige und erfolgreiche KMU
Kampf der Die Partei gegen Bürokratie
Bürokratie und übermässige Regulierung sind schädlich für den Wirtschaftsstandort Schweiz, sie
belasten unsere Firmen mit unnötigen Kosten. Gerade KMU, welche im kleinen Team innovativ und
flexibel bleiben müssen, werden durch eine hohe administrative Last enorm gebremst. Die Partei.Die
Liberalen hat sich den Kampf gegen die Bürokratie auf die Fahne geschrieben. Wir wollen einen
starken, aber schlanken Staat. Mit unserem Einsatz leisten wir einen wichtigen Beitrag zur
Eindämmung der regulatorischen Kosten für die Wirtschaft.
1. Bürokratiewachstum in der Schweiz zulasten der KMU"
FDP,"1. Bürokratiewachstum in der Schweiz zulasten der KMU
Eine geringe Regulierungsdichte und tiefe Regulierungskosten begünstigen die Entfaltung aller
Unternehmen. Sie sind aber gerade für KMU, die oft nur wenige Ressourcen haben, überlebenswichtig.
Weniger Bürokratie und Regulierungen verschaffen den KMU den nötigen Spielraum für ihre
unternehmerischen Tätigkeiten. Die Senkung von Regulierungskosten führt zu einer Erhöhung der zur
Verfügung stehenden Mittel in einer Firma und damit zu einer höheren Produktivität und mehr
Wirtschaftswachstum.
Die Regulierungswut hat gemäss verschiedenen Indikatoren in der Schweiz massiv zugenommen: Lag die
Schweiz noch vor zehn Jahren auf Rang zehn des «Ease of Doing Business» Indikators der Weltbank,
belegt sie seit Juni 2016 Platz 311
. Wir sind von dieser Entwicklung alarmiert. Daher setzen wir uns mit den
im Folgenden präsentierten Massnahmen insbesondere für KMU ein.
2. Regulierung reduzieren!"
FDP,"im Folgenden präsentierten Massnahmen insbesondere für KMU ein.
2. Regulierung reduzieren!
Wir haben ein dreistufiges Modell entwickelt, um der ausufernden Bürokratie effektiv entgegenzutreten:
1. Unabhängige und umfassende Regulierungsfolgeabschätzung
Neue Gesetzesvorlagen und Verordnungen generieren einen gewaltigen administrativen Aufwand für die
betroffene Wirtschaft. Deshalb berechnet die Verwaltung jeweils die Auswirkungen geplanter
Regulierungen anhand einer Regulierungsfolgeabschätzung (RFA). Heutzutage überprüft jedoch der
Regulator, das heisst der Bundesrat und die Verwaltung, sein Werk selber.
Eine unabhängige Kontrollstelle soll zukünftig die Berechnung der Regulierungskosten einer
Gesetzesvorlage und von Verordnungen überprüfen und diese einheitlich und öffentlich aufzeigen.
Gleichzeitig soll dies ermöglichen, die Bundesaufgaben zu reduzieren und so Kosten zu sparen. Wir
wurden in der Frühlingssession 2015 im Parlament in diesem Sinne aktiv und haben die Motion"
FDP,"wurden in der Frühlingssession 2015 im Parlament in diesem Sinne aktiv und haben die Motion
„Bürokratieabbau. Regulierungsfolgen durch eine unabhängige Stelle aufdecken“ eingereicht. Die Motion
wurde vom Nationalrat 2015 und vom Ständerat 2016 angenommen und an den Bundesrat überwiesen. Er
ist nun gefordert, die unabhängige Prüfung der Regulierungsfolgeabschätzungen einzuführen. Eine solche
1 The World Bank, „Ease of Doing Business”
Seite 2
Überprüfung würde Kosten verursachen; diese würden aber durch ""verhinderte Fehler"" bei Weitem
eingespart.
2. Einführung einer Regulierungsbremse
Aufbauend auf der RFA soll eine Regulierungsbremse dem Parlament bei besonders kostspieligen
Regulierungen eine höhere Hürde auferlegen. Wir haben daher die Fraktionsmotion „Mit einer
Regulierungsbremse den Anstieg der Regulierungskosten eindämmen“ eingereicht: Generiert eine Vorlage
für mehr als 10'000 Unternehmen erhebliche Kosten oder liegt sie über einer zu definierenden"
FDP,"für mehr als 10'000 Unternehmen erhebliche Kosten oder liegt sie über einer zu definierenden
Kostenschwelle, muss die Vorlage dem qualifizierten Mehr in der Gesamtabstimmung im Parlament
unterstellt werden. Eine höhere parlamentarische Hürde für Regulierung erlaubt es, unnötige
Regulierungskosten einzudämmen.
Des Weiteren fordern wir mit dem Postulat „Einführung einer Regulierungsbremse“, dass auch andere
Massnahmen, wie zum Beispiel ein „one in, one out“, geprüft werden.
3. Bestehende Regulierung überprüfen und reduzieren
In einem dritten Schritt fordern wir, dass der in Umsetzung begriffenen Regulierungskontrollstelle auch die
Kompetenz gegeben wird, gezielt bestehende Regulierungen zu überprüfen und zuhanden von Parlament
und Bundesrat Empfehlungen abzugeben, wie diese optimiert werden können. Die Stelle soll aus eigenem
Impuls oder aufgrund von Eingaben aus der Bevölkerung, Wirtschaft oder Justiz überprüfen können, ob"
FDP,"Impuls oder aufgrund von Eingaben aus der Bevölkerung, Wirtschaft oder Justiz überprüfen können, ob
bestehende Regulierung unverhältnismässig, nicht mehr sachgerecht oder unnötig kostentreibend ist.
Die Die Partei wurde in diesem Sinne in der Wintersession 2016 aktiv und hat die Fraktionsmotion
„Regulierungskontrollbehörde soll auch bestehende Regulierung überprüfen können“ eingereicht.
3. Bürokratiebriefkasten der Die Partei
Die Die Partei gibt seit Januar 2015 der Bevölkerung und Unternehmern die Möglichkeit, ihre Ärgernisse über
Bürokratie in unserem Bürokratie-Briefkasten (www.anti-bürokratie.ch) zu deponieren. Diese werden
anschliessend vertieft geprüft. Falls möglich, werden die Bedenken anschliessend aufgegriffen und in Form
eines Vorstosses im Parlament eingereicht. Dabei gehen wir aber vorsichtig vor, da ein Vorstoss erst einmal
Bürokratie generiert, zumal sich die Bundesverwaltung mit diesem auseinandersetzen muss.
4. Für einen Firmenalltag ohne unnötige Bürokratie"
FDP,"4. Für einen Firmenalltag ohne unnötige Bürokratie
Die Die Partei setzt sich darüber hinaus unermüdlich dafür ein, dass den Unternehmern ihre tägliche Arbeit nicht
durch administrative Leerläufe erschwert wird. Der Staat ist gefordert, für die Wirtschaft, insbesondere auch
für kleine und mittlere Betriebe, Rahmenbedingungen zu schaffen, welche es ermöglichen, eine Firma
administrativ möglichst kostengünstig und reibungslos zu führen.
Forderungen der Die Partei:
› Mehrwertsteuereinheitssatz: Dieser muss die seitenlangen Ausnahmen und Sonderregelungen
ausdünnen. Der Mehrwertsteuer-Dschungel mit verschiedenen Sätzen kostet die Unternehmen in der
Schweiz jährlich 1,76 Mia. Franken. Mit einem Einheitssatz sparen wir zu Gunsten der Wirtschaft Kosten
von mehreren 100 Mio. Franken ein!
› Zollbürokratie abschaffen: Die öffentliche Hand muss endlich Lösungen in Kraft setzen, welche KMU-
freundlich sind. Der Import, Export und Transit von Waren muss ohne übermässige Bürokratie möglich"
FDP,"freundlich sind. Der Import, Export und Transit von Waren muss ohne übermässige Bürokratie möglich
sein: Umfassende Digitalisierung der Zollverfahren, flexible Wahl des Grenzübertritts, Vereinfachung der
Mehrwertsteuererhebung, ortsunabhängige Verzollung auch für KMU, Erhöhung des Maximalbetrags für
vereinfachte Zollanmeldung und Abschaffung von Minimalzöllen, deren Ertrag den Erhebungsaufwand
nicht mehr rechtfertigen.
Seite 3
› Möglichkeit der eigenverantwortlichen Abschaffung der Arbeitszeiterfassung: Insbesondere
leitende Angestellte, Fachspezialisten und Arbeitnehmende mit Firmenbeteiligungen in KMU müssen sich
von der Stempelpflicht befreien können. Ein flexibles Home office und Teilzeitarbeit dürfen zudem durch
die Arbeitszeiterfassung nicht verunmöglicht werden.
› Stärkung des E-Governments: Die online Lösungen der öffentlichen Hand müssen ohne zusätzliche
Informatiksoftware und ohne zusätzlichen Schulungsaufwand den Firmenalltag erleichtern."
FDP,"Informatiksoftware und ohne zusätzlichen Schulungsaufwand den Firmenalltag erleichtern.
› Weniger Kontroll- und Statistikaufwand: Wir haben daher den Vorstoss „Keine Doppelspurigkeiten bei
der Datenerhebung“ eingereicht, welcher den durch die öffentliche Hand bedingten Statistikaufwand
reduzieren soll. Zudem fordern wir eine Stärkung des risikobasierten Ansatzes bei Kontrollen statt einer
inflationären Erhöhung der Kontrolldichte.
› Liberalisierung und Flexibilisierung des Aktienrechts: Viele KMU sind von der Aktienrechtsrevision
betroffen. Die Die Partei lehnt daher die Punkte des Entwurfs des Bundesrats, die gegen die wirtschaftliche
Freiheit (z.B. Geschlechter-Richtwerte) gehen, dezidiert ab. Wir wollen eine liberale und flexible Regelung
sowie eine schlanke Umsetzung der Minderinitiative (Volksinitiative „Gegen die Abzockerei“).
› Unbürokratisches öffentliches Beschaffungsrecht: Über das bestehende Konkordat hinaus müssen"
FDP,"› Unbürokratisches öffentliches Beschaffungsrecht: Über das bestehende Konkordat hinaus müssen
die kantonalen Regelungen weiter harmonisiert werden, damit KMU interkantonal weniger
Regulierungsaufwand zu tragen haben. Zudem: Keine Benachteiligung von KMU über ungerechtfertigte
Grösse des Beschaffungsauftrages (Losgrösse)!
› Kleinstunternehmen entlasten: Dies unter anderem durch gerechte Regulierung im Revisionsrecht
(„KMU-taugliche Lösung sichern. Eingeschränkte Revision zum Schutz unserer KMU verwesentlichen“)
und Beibehaltung des vereinfachten Abrechnungsverfahrens im Rahmen der Gesetzesrevision zur
Bekämpfung der Schwarzarbeit.
5. Für eine moderne Bundesverwaltung
Die Bundesverwaltung nimmt eine bedeutende Rolle in unserem Land ein. In ihren täglichen Interaktionen
mit Unternehmen, Kantonen und Gemeinden, soll die Bundesverwaltung auch betreffend die Digitalisierung
eine Vorbildfunktion einnehmen.
Forderungen der Die Partei:"
FDP,"eine Vorbildfunktion einnehmen.
Forderungen der Die Partei:
› Voll elektronischer Geschäftsverkehr: Aus diesem Grund fordert die Die Partei, dass sämtliche Geschäfte
zwischen Bundesstellen und Unternehmen (z.B. Bewilligungen, Anträge, Abrechnungen, etc.) einerseits
und Bundesstellen und Kantonen andererseits zwingend auch voll elektronisch – medienbruchfrei -
angeboten werden. Dieses elektronische Angebot ist – ergänzend zum bisherigen papierbasierten
Angebot – mit angemessenen Übergangsfristen gesetzlich einzufordern.
› One-Stop-Shop anbieten: Ebenfalls sollen die gesetzlichen Anpassungen vorgenommen werden, damit
Unternehmen ihre elektronischen Behördengänge gegenüber der Bundesverwaltung ausschliesslich
über ein einziges Transaktionsportal (One-Stop-Shop) abwickeln können.
› Elektronische Unterschrift nutzen: Weiter sollen die gesetzlichen Grundlagen dahingehend angepasst
werden, dass die Bundesverwaltung in ihrer elektronischen Korrespondenz, einschliesslich Verfügungen,"
FDP,"Bewilligungen etc. grundsätzlich die elektronische Unterschrift benutzt.
3 Säulen für Wohlstand und Unternehmertum in der
Schweiz
Forderungen der Die Partei in der Wirtschaftspolitik
Das Erfolgsmodell Schweiz hat massgeblich dazu beigetragen, dass die Schweizer Bevölkerung im
internationalen Vergleich über einen sehr hohen Wohlstand verfügt. Doch dieses Erfolgsmodell ist
unter Druck: Krisen und Machtverschiebungen stellen die Schweiz vor zahlreiche Herausforderungen.
Der Druck kommt aber nicht nur von aussen, auch innenpolitisch sieht sich die liberale
Wirtschaftsordnung der Schweiz immer neuen Angriffen ausgesetzt. Der Handlungsbedarf ist akut: Der
Wirtschaftsstandort braucht mehr gut ausgebildete Fachkräfte und weniger lähmende, komplizierte
Administrativprozesse. Eine offene Volkswirtschaft wie die Schweiz benötigt ausserdem stabile
Handelsbeziehungen mit globalen Märkten und insbesondere den wichtigsten Handelspartnern in"
FDP,"Handelsbeziehungen mit globalen Märkten und insbesondere den wichtigsten Handelspartnern in
Europa. Das Ziel ist, dass die Schweiz ihre internationale Konkurrenzfähigkeit noch verstärkt. Damit
der Schweizer Wohlstand auch morgen Bestand hat, müssen liberale Prinzipien wegleitend sein:
Eigenverantwortung anstatt staatlicher Bevormundung, Anreize statt Verbote, Marktwirtschaft anstelle
staatlicher Eingriffe und mehr Freihandel dafür weniger Protektionismus.
Die Schweiz ist eine kleine, offene Volkswirtschaft und gehört zu den Ländern mit dem höchsten Wohlstand der
Welt. In Punkto Lebensqualität, Bildung, Innovation, oder Beschäftigung gehört das Land zur Spitzengruppe.1
Diese Vorteile haben zur Krisenresistenz der Schweiz beigetragen. So erholte sich die hiesige Wirtschaft im
Vergleich zu anderen Ländern nach der Corona-Pandemie schneller und auch die derzeitigen Preisschocks konnte
die Schweiz bisher besser als ihre Nachbarn im Euro-Raum abfedern.
Innenpolitische Hürden"
FDP,"die Schweiz bisher besser als ihre Nachbarn im Euro-Raum abfedern.
Innenpolitische Hürden
Doch das Erfolgsmodell Schweiz steht innenpolitisch unter Druck. Von verschiedenen Seiten werden immer neue
Hürden aufgebaut und Wettbewerbsvorteile zunichte gemacht. Die Schweiz befindet sich in einem veritablen
Reformstau. So bleiben beim Steuersystem wichtige Anpassungen auf der langen Bank oder ähneln, wie der
Versuch das Arbeitsrecht zu modernisieren, einer Sisyphusarbeit. Laufende wirtschafts- und standortschädliche
Referenden und Initiativen, zunehmender Widerstand gegen nachhaltige Finanzreformen, sowie eine regelrechte
Regulierungswut erschweren diese Aufgabe und gefährden den Wohlstand. Die Herausforderungen sind
zahlreich und nachhaltige und gezielte Reformen sind dringend notwendig, um mit den vielen Veränderungen der
Gesellschaft und Wirtschaft Schritt zu halten.
Internationale Entwicklungen zwingen zu Anpassungen"
FDP,"Gesellschaft und Wirtschaft Schritt zu halten.
Internationale Entwicklungen zwingen zu Anpassungen
Die Schweiz ist keine Insel. Der russische Angriffskrieg gegen die Ukraine, höhere Energie- und
Nahrungsmittelpreise, Corona-Pandemie, Klimawandel oder internationale Lieferkettenprobleme sind auch
hierzulande zu spüren. Diese multiplen Krisen haben die strukturellen Probleme im Land noch weiter akzentuiert.
Davon sind auch wichtige Handelspartner der Schweiz betroffen. Eine sich abzeichnende Rezession in Europa,
würde auch die Schweiz hart treffen. Zu diesen zahlreichen Unsicherheiten gesellt sich eine zunehmende
Abschottungspolitik wichtiger Handelspartner. China und die USA zum Beispiel operieren vermehrt mit Zöllen,
um ihren Heimmarkt zu schützen. So bleibt die internationale Instabilität hoch und die Tendenz zur Blockbildung
nimmt zu.
Die stockende Weiterentwicklung der bilateralen Beziehungen zur Europäischen Union (EU) belastet die Schweiz"
FDP,"1 OECD Better Life Index: Schweiz; IMD World Competitiveness Ranking; WEF Global Competitiveness Report
Die Partei.Die Liberalen | Generalsekretariat | Neuengasse 20 | Postfach | CH-3001 Bern
+41 (0)31 320 35 35 | www.fdp.ch | info@fdp.ch | /fdp.dieliberalen | @Die Partei_Liberalen Seite 1 / 7
ebenfalls; insbesondere mit Blick auf internationale Forschungs-, Entwicklungs- und Produktionsnetzwerke.
Investitionsentscheide werden zunehmend von dieser Unsicherheit geprägt, was dem Wirtschaftsstandort
abträglich ist. Die Steuervorschriften der OECD (aktuell mit den Vorschriften zur Mindestbesteuerung) greifen
einen wichtigen Standortvorteil der Schweiz an. Der Wegfall dieser Steuervorteile muss kompensiert werden und
es müssen Massnahmen ergriffen werden, um die Standortattraktivität auch für die Zukunft zu sichern.
Liberale Rezepte nötig
Der wirtschaftspolitische Handlungsbedarf ist akut. Wir sind drauf und dran unseren Wohlstand zu verspielen."
FDP,"Um diesem Trend entgegenzuwirken, braucht es qualifizierte Arbeitskräfte und einen flexiblen Arbeitsmarkt, einen
gesunden Staatshaushalt, Innovationsfähigkeit, internationale Offenheit, weniger Bürokratie, Rechtssicherheit
und einen starken, aber schlanken Staat. Die Die Partei hat das Rezept zur Sicherung des Wohlstands für Menschen
und zur Sicherung der Wettbewerbsfähigkeit von Unternehmen. Dieses steht auf drei Säulen.
1 Wirtschaftliche Dynamik und qualifizierte Arbeitskräfte sicherstellen
Der Fachkräftemangel in der Schweiz wird sich aufgrund der hohen Nachfrage nach qualifizierten Arbeitskräften,
des anhaltenden Trends zur Akademisierung und langfristig infolge des demografischen Wandels weiter
zuspitzen. Eine Modernisierung und Flexibilisierung des Arbeitsmarkts und des Arbeitsrechts sind notwendig. Die
Anreize müssen so ausgestaltet sein, dass das Potenzial der Erwerbspersonen maximal ausgeschöpft werden"
FDP,"kann: Hierzu zählen Massnahmen, die versuchen, Menschen länger im Arbeitsmarkt zu halten, Teilzeitpensen
aufzustocken sowie in- und ausländisches Fachkräftepotenzial auszuschöpfen. Daneben muss das duale
Berufsbildungssystem, das ein entscheidender Pfeiler des Erfolgsmodells Schweiz ist und für gut ausgebildete
Fachkräfte sorgt, gestärkt werden.
1.1 Weniger Bürokratie – mehr Digitalisierung
Um die knappen Fachkräfte sinnvoll einzusetzen, sind effiziente Prozesse notwendig. Unnötige regulatorische
Anforderungen gilt es zu vermeiden und negative Anreize zu beseitigen. Die Gesetzes- und Verordnungsflut
schränkt unsere Freiheiten ein, die Schweiz ächzt unter Bürokratie, die Geld, Zeit und Nerven kostet.
Zur Vereinfachung des administrativen Aufwands sollen die Behörden-Prozesse digitalisiert2, die E-Government-
Dienstleistungen ausgebaut und die E-ID rasch eingeführt werden. Mögliche Investoren und interessierte Firmen"
FDP,"müssen zudem über einen one-stop-shop eine zentrale Anlaufstelle haben, um Abklärungen treffen zu können.
Im Falle einer effizienteren Abwicklung sollte die Höhe der jeweiligen Gebühren entsprechend gesenkt werden.
Auch bei der Infrastrukturqualität gibt es Verbesserungsbedarf (Telefonnetz, Stromnetz, Wasserversorgung,
Mobilität usw.). Die derzeitigen Blockaden wie beispielsweise bei der 5G-Technologie bergen das Risiko eines
Rückstandes für unser Land, was unweigerlich zu einem Nachteil gegenüber anderen Staaten führen wird.3 Die
Die Partei setzt sich konsequent für wissenschafts- und risikobasierte Entscheide ein, das heisst: Risiken managen statt
Technologien verbieten. In diesem Sinne ist der Einsatz moderner Technologien zu erleichtern (z.B. neue
gentechnische Verfahren).
Um unsere Unternehmen vor unnötigen Regulierungskosten zu schützen, gibt es eine wirksame Die Partei-Lösung: die"
FDP,"Regulierungsbremse. Analog der Schuldenbremse sollen damit Regulierungen, die Unternehmen besonders stark
belasten würden, im Parlament einem qualifizierten Mehr unterstellt werden. Eine unabhängige Prüfstelle für
Regulierungsfolgeabschätzungen soll weiter Abhilfe schaffen und ein Ablaufdatum für Gesetze, wo möglich und
sinnvoll, eingeführt werden.
Die Mehrwertsteuer stellt aufgrund ihrer Komplexität und den zahlreichen Ausnahmeregelungen eine grosse
administrative und finanzielle Belastung für Unternehmen dar. Zur Vereinfachung des Mehrwertsteuersystems
muss endlich ein Einheitssatz eingeführt werden. Weiter könnte in Bezug auf die Mehrwertsteuer eine
Entschlackung im Geschäfts-Verkehr geprüft werden, z.B. in Form eines Wegfalls der tatsächlichen Abrechnung
bis zur Endleistung.
4 Im Bereich der direkten Besteuerung von natürlichen Personen wird am Ziel einer Easy Swiss
2 Mo. Dobler 22.3122 Nutzenorientierte Digitalisierungsoffensive der Schweizer Verwaltung"
